original,simplified_human,simplified_by_model
지역 부동산업계는 마감이 오는 29일이어서 추가로 구역 3~5곳이 접수할 것으로 전망하고 있다.,"지역의 집과 땅을 사고파는 사람들이 모여 있는 곳에서는 29일에 마감이 있어서, 앞으로 3곳에서 5곳의 새로운 지역이 추가로 신청할 것으로 예상하고 있어요.",지역 부동산 업계는 29일에 마감하는 지역을 더 많이 접수할 것으로 예상하고 있어요.
"생활권은 기존 4개 중 오포와 경안 등지를 하나로 묶어 3개(오포·경안, 곤지암·초월, 남한산성·퇴촌)로 재편한다는 방침이다.","생활권은 원래 4개 지역이 있었는데, 그 중 오포와 경안 지역을 합쳐서 3개 지역으로 나누기로 했어요. 새로운 지역은 오포·경안, 곤지암·초월, 남한산성·퇴촌 이렇게 3개로 정해졌어요.","생활권은 지금까지 4개 지역을 하나로 합쳐서 3개로 나누기로 했어요. 여기에는 오포와 경안, 곤지암과 초월, 남한산성과 퇴촌이 포함되어 있어요."
지난해 1월 발행된 그리고카드는 코로나19 상황 속에서 소비를 촉진하고 지역자금 역외유출을 막는 등 상경기 활성화에 한몫을 하고 있다는 평가를 받고 있다. 그리고카드는 발행 초기 100만원 한도액에 6~15%의 인센티브를 제공했지만 이후 50만원에 6~10%의 인센티브를 지급하고 있으며 가입자가 3만여명에 달한다.,"작년 1월에 나온 '그리고카드'는 코로나19 때문에 어려운 상황에서 사람들의 소비를 도와주고, 지역 돈이 다른 곳으로 빠져나가는 것을 막는 데 도움이 되고 있다는 평가를 받고 있어요. 처음에는 카드 사용 한도가 100만원이었고, 6%에서 15%까지의 보너스를 줬지만, 지금은 한도가 50만원으로 줄어들었고 보너스는 6%에서 10%로 바뀌었어요. 이 카드를 사용하는 사람은 3만 명이 넘어요.","지난해 1월에 발행된 그리고카드는 코로나19로 인해 경제가 활성화되도록 도와주고, 돈이 해외로 나가는 것을 막는 역할을 하고 있다고 평가받고 있어요. 그리고카드는 처음 100만 원을 사용할 수 있게 해주는 데 6%에서 15%의 보상을 제공했지만, 이후에는 50만 원을 사용할 때 6%에서 10%의 보상을 주는 방식으로 바뀌었어요. 그리고카드는 현재 3만 명 이상의 가입자들이 있어요."
임성빈 시 경제과장은 “이번 이벤트를 통해 동해사랑상품권의 활성화는 물론 시민 가계부담 경감과 위축된 소비시장이 살아나 시민과 소상공인 모두 따뜻한 겨울을 맞이하는데 조금이라도 보탬이 됐으면 한다”고 말했다.,"임성빈 경제과장은 “이번 행사로 동해사랑상품권이 더 많이 사용되기를 바라며, 시민들의 생활비 부담을 줄이고, 소비가 활발해져서 시민들과 작은 가게 주인들이 모두 따뜻한 겨울을 보낼 수 있도록 도움이 되었으면 좋겠다”고 말했습니다.","임성빈 시 경제과장은 “이번 이벤트 덕분에 동해사랑상품권을 더 많이 사용하고, 시민들의 생활 부담을 줄여주고, 소비가 줄어드는 것을 도와주려고 노력하고 있어요. 그래서 따뜻한 겨울을 보내는 데 조금이라도 도움이 되었으면 좋겠어요”라고 말했어요."
"유가증권시장에서 기관이 951억원을 순매수하면서 지수 상승을 이끌었다. 개인과 외국인은 각각 601억원, 367억원을 순매도했다.","기관이 유가증권시장에서 951억원을 사면서 주식 시장의 지수가 올랐어요. 반면, 개인 투자자와 외국인 투자자는 각각 601억원과 367억원을 팔았어요.","유가증권시장에서 큰 돈이 기관에서 951억원을 순매수하면서 주식 시장이 오르는 데 큰 역할을 했어요. 개인 투자자들은 각각 601억원을 순매수했고, 외국 투자자들은 각각 367억원을 순매수했어요."
1일 부천시에 따르면 시는 중소기업 지원책의 하나로 성장 잠재력을 가진 작지만 강한 유망 중소기업을 발굴하고자 강소기업을 선정한다.,"부천시에서는 중소기업을 도와주기 위해, 성장 가능성이 큰 작지만 힘이 있는 좋은 중소기업을 찾고 있어요. 그래서 특별한 기업을 뽑고 있어요.","부천시가 오늘 발표한 내용에 따르면, 중소기업을 키우고 성장할 가능성이 있는 작은 기업들을 찾아서 특별히 도와줄 거예요."
"더존비즈온의 매출채권팩토링은 실시간 세무·회계 빅데이터를 활용, 기업 정보와 기업간 매출 진위 여부를 제공한다. 또 자금 공급자는 이 정보를 바탕으로 심사 후 일정 할인율로 매출 채권을 매입하게 된다.","더존비즈온의 매출채권팩토링은 회사의 돈과 세금에 대한 큰 데이터를 사용해서, 다른 회사의 정보와 매출이 진짜인지 아닌지를 알려줘. 그리고 돈을 빌려주는 사람은 이 정보를 보고 심사를 한 후, 정해진 할인율로 회사의 매출 채권을 사게 돼.","더존비즈온의 매출채권팩토링은 실시간으로 세금과 회계 정보를 이용해서 기업 정보를 제공하고, 기업 간의 거래가 사실인지 확인해준다. 그리고 돈을 빌려주는 사람들은 이 정보를 바탕으로 거래를 평가하고, 일정 비율로 매출 채권을 사서 거래를 진행하게 된다."
최근 춘천지역에 주상복합 등 대형건축물 신축 ‘붐’이 일고 있는 가운데 차기 시정에서 대형건축물 인허가 기조가 바뀔지 주목된다.,최근 춘천 지역에서는 아파트와 상점이 함께 있는 큰 건물을 많이 짓고 있어요. 그래서 앞으로 이 지역에서 큰 건물을 허가해주는 규칙이 어떻게 바뀔지 많은 사람들이 관심을 가지고 지켜보고 있어요.,최근 춘천 지역에서 큰 건물들이 새로 생기고 있어서 많은 사람들이 관심을 가지고 있어요. 앞으로 이 건물들을 허가하는 방법이 어떻게 바뀔지 궁금해요.
"작년 대비 1인 가구가 가장 큰 폭으로 증가한 연령대는 60대였다. 60대 1인 가구는 지난 1년 새 13.2% 급증했는데, 특히 남자 60대(15.6%) 증가율이 높았다.","작년과 비교했을 때, 혼자 사는 1인 가구가 가장 많이 늘어난 나이는 60대였다. 60대 혼자 사는 사람은 지난 1년 동안 13.2%나 늘었고, 특히 남자 60대가 15.6%로 더 많이 증가했다.","작년과 비교했을 때, 1인 가구가 가장 많이 늘어난 연령대는 60대였어요. 60대 1인 가구는 지난 1년 동안 13.2%나 늘어난 거예요. 특히 남자 60대(15.6%)가 가장 많이 늘어난 이유를 설명해줘요."
"감면대상은 각 세대주에게 부과되는 주민세 개인분, 착한 임대인 대상 재산세(100만원 한도), 자동차등록원부에 영업용으로 등록된 차량의 자동차세액 (100%) 등이다.","감면대상은 각 집의 주인이 내야 하는 주민세 개인분, 착한 임대인에게 주는 재산세(최대 100만원), 그리고 영업용으로 등록된 자동차의 자동차세(100%) 등이에요.","감면받을 수 있는 돈은 각 세대주에게 내야 하는 주민세에 대한 개인분, 좋은 임대인에게 내야 하는 재산세(100만원 한도), 그리고 자동차 등록원부에 영업용으로 등록된 차량의 자동차세액(100%) 같은 것들이 있어요."
중기부는 신청 내용을 확인해 손실보전금 지급 여부를 결정한다.,"중소기업부는 사람들이 신청한 내용을 보고, 돈을 줄지 말지를 결정해요.",중기부는 신청 내용을 확인해서 돈을 돌려줄지 여부를 결정합니다.
일명 ‘상품권 깡’ 등 부정 유통 사례가 끊이지 않는 지역사랑상품권에 대한 규제 강화가 추진된다. 부정행위가 적발된 가맹점에 대한 재등록 제한 규정을 신설하는 한편 규제 현장에서 과태료를 적극적으로 부과하도록 액수를 낮추기로 했다.,"일종의 상품권을 부정하게 사용하는 사람들이 많아서, 이를 막기 위해 지역사랑상품권을 더 엄격하게 규제하려고 해요. 부정행위를 한 가게는 다시 등록할 수 없게 하고, 벌금을 줄여서 더 엄격하게 규제할 거예요.","‘상품권 깡’ 같은 부정행위가 계속 일어나고 있는 지역사랑상품권에 대한 규제가 강화될 예정이에요. 부정행위를 발견한 가게에 대한 재등록 제한을 만들고, 규제에 따라 과태료를 더 적게 부과할 계획이에요."
"■정부·지자체 주도 건설 활성화 정책 마련 시급=이에 건설산업연구원은 지역건설산업 활성화를 위해 정부, 지자체 주도의 정책 마련이 필요하다고 주장했다. 우선 중앙정부 제안 정책으로는 지역 공공 건설투자 확대를 위한 예비타당성조사 제도개선, 지방 인프라 투자 확대, 민간투자사업 활성화 및 지역건설업 참여 유도 확대, 중소 지역건설업 계약목표제 등을 제안했다. 지방자치단체 주도 정책으로는 신규인프라 사업 발굴을 통한 수요 창출, 지역건설업 보호 지원제도의 내실화, 부실 지역건설산업 퇴출시스템 정비 등이 필요 정책으로 지목됐다.","정부와 지역 단체가 건설을 더 활발하게 할 수 있는 방법을 빨리 만들어야 해요. 건설산업연구원이라는 곳에서는 정부와 지역 단체가 함께 힘을 모아야 한다고 말했어요. 

먼저, 중앙정부에서 제안한 방법은 다음과 같아요:
1. 지역에서 공공 건설에 더 많은 돈을 쓰기 위해 필요한 조사를 더 잘 하자.
2. 지방의 인프라, 즉 도로, 다리 같은 시설에 더 많은 투자를 하자.
3. 민간 기업이 건설에 참여할 수 있도록 도와주고, 지역 건설업체가 더 많이 참여하도록 하자.
4. 작은 지역 건설업체가 계약을 따낼 수 있도록 목표를 세우자.

그리고 지역 단체가 주도해야 할 방법은:
1. 새로운 건설 사업을 찾아내서 수요를 늘리자.
2. 지역 건설업체를 보호하고 지원하는 제도를 더 잘 운영하자.
3. 문제가 있는 지역 건설업체를 정리하는 시스템을 만들자.

이런 방법들이 필요하다고 생각해요.","■정부와 지역이 함께 힘을 모아 건설을 활성화해야=이에 건설연구원은 지역 건설을 더 발전시키기 위해 정부와 지역이 함께 힘을 모으는 정책이 필요하다고 말했어요. 먼저 중앙 정부에서 제안한 정책으로는 공공 건설에 더 많은 돈을 투자하고, 지역의 인프라를 더 잘 만들기 위한 제도 개선, 민간 투자 사업을 활성화하고, 지역 건설업 참여를 늘리는 방법 등을 제안했어요. 또, 작은 지역 건설업을 도와주는 지원 제도를 더 잘 만들고, 잘못된 지역 건설업을 없애는 시스템을 고치라는 의견도 나왔어요."
기준 중위소득 100% 이하 여부를 가르는 기준은 격리시점에서 최근에 납부한 건강보험료다.,"기준 중위소득 100% 이하인지 확인하는 방법은, 격리된 시점에서 최근에 낸 건강보험료를 보는 거예요.","기준 중위소득이 100% 이하인 사람들을 보면, 최근에 건강보험료를 내지 않았다는 뜻이에요."
"과표 1천200만∼1천400만원의 적용세율이 기존 15%에서 6%로 9%포인트, 4천600만∼5천만원 구간의 적용세율이 24%에서 15%로 9%포인트 낮아지는데 소득이 작으면 이런 제도 변경을 충분히 체감할 수 없기 때문이다.","소득이 1천200만 원에서 1천400만 원인 사람의 세금이 15%에서 6%로 줄어들고, 4천600만 원에서 5천만 원인 사람의 세금도 24%에서 15%로 낮아져요. 이렇게 세금이 줄어드는 건 좋은 일이지만, 소득이 적은 사람들은 이런 변화가 크게 느껴지지 않을 수 있어요.","과표 1천200만 원에서 1천400만 원의 세금 기준이 원래 15%에서 6%로 줄어들었는데, 소득이 적으면 이런 변화를 잘 느끼기 어려울 수 있어요."
"임대해줄 당시 도로 옆으로 높이 90㎝ 옹벽이 설치돼 경사면을 이루고 있었지만, 현재 도로 옆을 평지로만 메웠다는 게 A씨의 주장이다.","A씨는 처음에 도로 옆에 90㎝ 높이의 벽이 있어서 경사가 있었지만, 지금은 도로 옆이 평평하게 메워졌다고 주장하고 있어요.","A씨는 임대해줄 때 도로 옆에 90cm 높이의 옹벽이 있었는데, 그 옹벽이 경사면을 이루고 있었다고 주장하고 있어요. 하지만 지금은 도로 옆을 평지로만 덮어버렸다는 거예요."
1인 가구 700만명 첫 돌파…3집 중 1곳은 1인가구,우리나라에서 혼자 사는 사람이 700만 명을 넘었어요. 이제 집 3채 중 1채는 혼자 사는 집이에요.,1인 가구가 700만 명을 넘었어요. 3집 중 1곳은 1인 가구예요.
해당 지원센터는 반월·시화산단은 물론 도내 소재·부품·장비 전문기업의 디지털 전환(DX) 추진은 물론 첨단 제조기술 기반의 신제품·신서비스 개발을 지원하는 역할을 담당하게 된다.,"이 지원센터는 반월·시화산업단지와 경기도에 있는 부품과 장비를 만드는 전문 회사들이 더 잘 디지털화(컴퓨터와 인터넷을 이용해 더 편리하게 바꾸는 것)할 수 있도록 도와주고, 최신 기술을 이용해 새로운 제품이나 서비스를 만들 수 있도록 지원하는 역할을 합니다.","해당 지원센터는 반월과 시화산단뿐만 아니라 지역의 제조업체들이 디지털 전환(DX)을 이루고, 최신 기술을 이용해 새로운 제품과 서비스를 개발하는 데 도움을 줄 거예요."
올해 지원 규모는 대출금 기준 67억원이다. 기업 운영에 소요되는 시설 및 운전자금 용도로 해당업체가 융자를 받으면 군에서 2년 동안 3%의 이자차액 보전금을 지원한다.,"올해 군에서 지원하는 돈은 67억원이에요. 기업이 운영하는데 필요한 돈을 빌리면, 군에서 2년 동안 3%의 이자를 보조해준답니다.","올해 지원받는 돈은 대출을 받을 때 기준이 67억원이에요. 만약 기업이 돈을 빌려서 운영하는 데 필요한 돈을 융자받으면, 군에서 2년 동안 3%의 이자차금을 도와줄 거예요."
A씨는 피해자들로부터 받은 돈을 회사 운영비와 개인 채무 변제 등에 사용한 것으로 조사됐다. A씨는 경찰 조사에서 “정당한 계약이고 사기 분양이 아니다”라며 혐의를 부인한 것으로 전해졌다.,"A씨는 피해자들한테서 받은 돈을 회사 운영비와 개인 빚 갚는 데 쓴 것으로 조사되었어요. A씨는 경찰 조사에서 “이건 정당한 계약이고, 사기가 아니다”라고 주장하며 혐의를 부인했다고 전해졌어요.",A씨는 피해자들에게 받은 돈을 회사 운영비와 개인적인 빚을 갚는 데 사용했다고 조사되었어요. A씨는 경찰 조사에서 “정당한 계약이고 사기 같은 일이 아니었다”라고 말하며 혐의를 부인했다고 전해졌어요.
26일 통계청이 발표한 경제활동인구 조사 고령층 부가 조사 결과에 따르면 올해 5월 기준 고령층 인구는 전국 1천509만8천명으로 1년 전보다 33만2천명(2.2%) 증가했다. 10년 전(1천34만8천명)만 해도 1천만명대 초반에 그쳤던 고령층 인구는 올해 처음으로 1천500만명을 넘어섰다.,"26일에 통계청이 발표한 조사 결과에 따르면, 올해 5월에 우리나라의 고령층 인구는 1천509만8천명으로 나타났어요. 이 숫자는 작년보다 33만2천명(2.2%) 더 많아진 거예요. 10년 전에는 고령층 인구가 1천34만8천명으로 1천만명도 안 됐었는데, 올해는 처음으로 1천500만명을 넘었어요. 즉, 나이가 많은 사람들의 수가 계속 늘어나고 있다는 뜻이에요.","26일에 통계청에서 발표한 경제활동인구 조사 결과에 따르면, 올해 5월에 우리나라의 고령층 인구가 1천509만8천명으로 늘어났어요. 이는 1년 전보다 33만2천명(2.2%)이나 늘어난 수치예요. 10년 전인 1천34만8천명보다 처음으로 1천만명 이상이 되었던 고령층 인구는 올해 처음으로 1천500만명에 가까워졌어요."
이순종 인천중소기업회장은 “노란우산공제는 위기의 순간에 소기업·소상공인이 재기할 수 있게 해주는 희망의 빛이다”며 “지역 내 소상공인의 많은 관심과 가입을 기대한다”고 했다.,이순종 인천중소기업회장은 “노란우산공제는 어려운 상황에서 작은 가게와 사업을 하는 사람들이 다시 일어설 수 있도록 도와주는 희망의 빛이에요. 그래서 지역의 작은 가게 주인들이 많이 관심을 가지고 가입해주길 바래요”라고 말했어요.,이순종 인천중소기업회장은 “노란우산공제는 어려운 상황에 있는 작은 기업과 가게들이 다시 시작할 수 있도록 도와주는 희망의 빛이다”라고 말했습니다. “우리 지역의 작은 가게들이 많은 관심을 가지고 가입할 수 있기를 기대합니다.”
의왕시는 다음달까지 이동·삼동 괴말지구 토지주 간 지적경계 합의를 진행한다.,의왕시는 다음 달까지 이동과 삼동 지역에 있는 괴말지구의 땅 주인들과 땅의 경계를 정하는 일을 할 거예요.,의왕시는 다음 달까지 이동·삼동 괴말지구의 땅 주인들이 서로 합의한 지적 경계를 만들려고 해요.
"해당 재개발 구역들은 시의 사전타당성 검토 결과를 토대로 토지 등 소유자 70% 이상, 토지 면적의 50% 이상 등의 동의로 정비계획을 시에 제안하면 시는 심사를 거쳐 결정고시한다.","재개발이 필요한 지역에서는, 먼저 시청에서 이 지역이 재개발이 가능한지 검토해요. 그 다음, 그 지역의 땅이나 건물을 가진 사람들 중 70% 이상이 동의하고, 그 땅의 면적이 50% 이상이 동의하면, 그 사람들이 시청에 재개발 계획을 제안할 수 있어요. 그러면 시청에서는 그 계획을 검토하고, 괜찮다고 판단되면 공식적으로 발표해요.","해당 재개발 지역들은 시에서 미리 검토한 결과에 따라 땅의 소유자가 70% 이상, 땅의 면적이 50% 이상 동의하면 시청에 계획을 제안할 수 있어요. 시청이 검토한 결과에 따라 결정이 내려질 거예요."
"국가산업단지는 국가기간산업의 발전, 첨단과학기술산업 등을 육성하거나 개발 촉진이 필요한 낙후지역을 산업단지로 개발하기 위해 산업입지 및 개발에 관한 법률 제6조에 따라 지정한다. 둘 이상의 특별시·광역시·특별자치시 또는 도에 걸쳐 있는 지역도 국가산업단지 대상에 포함된다.","국가산업단지는 나라의 중요한 산업을 발전시키고, 최신 과학 기술이 필요한 지역을 발전시키기 위해 만들어진 특별한 지역이에요. 이 지역은 법에 따라 정해지며, 여러 도시나 도가 함께 있는 곳도 포함될 수 있어요.","국가산업단지는 나라에서 중요한 산업을 발전시키고, 새로운 기술을 개발하는 지역을 도와주기 위해 만들어집니다. 이 지역이 나이가 많거나 산업이 부족한 곳을 산업단지로 개발하기 위해 지정됩니다. 두 개 이상의 특별한 지역이나 도시가 있는 경우도 국가산업단지에 포함됩니다."
또 마을회관에서 만난 한 주민이 “우정마을에 평생을 살아오면서 사정상 잠시 두 달간 주소를 옮겼는데 주거 이전비를 못 받게 됐다” 며 하소연하자 “구제할 방법이 있는지 알아보겠다”고 했다.,"마을회관에서 한 주민이 “우정마을에서 평생 살았는데, 어떤 이유로 두 달 동안 주소를 옮겼더니 집을 옮긴 돈을 받을 수 없게 됐다”고 이야기했어요. 그러자 누군가 “도와줄 방법이 있는지 알아볼게요”라고 대답했어요.","또 마을회관에서 만난 한 주민이 “우정마을에 평생 살면서 힘든 상황 때문에 한 달 동안 집을 옮겼는데, 이사 비용을 못 받을 것 같아서 걱정한다”며 “이런 방법이 있는지 알아보겠다”고 말했어요."
"최근 물가 및 금리 상승으로 어려움을 겪는 군민과 지역상인들을 위해 군은 새해 설 연휴를 앞두고 철원사랑상품권 10% 할인판매를 실시한다. 판매 기간은 오는 1월1일부터 20일까지이며 개인당 50만원까지 구매할 수 있다. 지류형 상품권은 지역 농축협과 새마을금고, 신협, 산림조합에서 구매할 수 있으며 카드형은 지역 농축협과 우체국, 새마을금고 등에서 발급 또는 충전할 수 있다.","최근 물가와 금리가 올라서 힘든 시간을 보내고 있는 군민과 지역 상인들을 돕기 위해, 군에서는 새해 설 연휴 전에 철원사랑상품권을 10% 할인해서 판매합니다. 이 상품권은 1월 1일부터 20일까지 살 수 있고, 한 사람이 최대 50만 원까지 구매할 수 있어요. 종이로 된 상품권은 지역의 농협, 새마을금고, 신협, 산림조합에서 살 수 있고, 카드 형태의 상품권은 농협, 우체국, 새마을금고 등에서 받을 수 있거나 충전할 수 있습니다.","최근 물가가 오르고, 이자도 높아지면서 힘든 시간을 보내고 있는 군민과 지역 상인들을 위해, 군은 새해 설 연휴를 앞두고 철원사랑상품권을 10% 할인 판매를 시작했어요. 이 상품권은 1월 1일부터 20일까지 사용할 수 있으며, 한 사람당 최대 50만원까지 구매할 수 있어요. 상품권은 지역 농축협, 새마을금고, 신협, 산림조합에서 구매하거나, 카드형으로는 지역 농축협, 우체국, 새마을금고에서 발급하거나 충전할 수 있어요."
이성수 숭실대 교수는 기조연설을 통해 “우리나라 자동차 산업이 발전하기 위해서는 차량용 반도체 설계 클러스터 구축과 후공정 분야가 꼭 필요하다”며 “정주 여건과 자동차 부품 산업기반이 있는 원주에 실현됐으면 한다”고 했다.,이성수 숭실대 교수님은 중요한 발표에서 “우리나라의 자동차 산업이 더 발전하려면 자동차에 필요한 반도체를 설계하는 곳과 후공정이라는 과정이 꼭 필요해요. 그리고 원주처럼 좋은 조건과 자동차 부품 산업이 있는 곳에서 이런 것들이 이루어졌으면 좋겠어요.”라고 말씀하셨어요.,이성수 숭실대 교수는 기조연설에서 “우리나라 자동차 산업이 더 발전하기 위해서는 차량에 사용되는 반도체 설계와 공정을 만드는 곳이 꼭 필요하다”고 말했습니다. 그리고 “정주 여건과 자동차 부품 산업이 잘 이루어지면 원주에 이런 시설이 생겼으면 좋겠다”고 덧붙였습니다.
"이에 해당하는 임대인은 총 200명으로, 대위변제액은 6천925억원에 달한다. 국토부는 이 가운데 26명의 임대인(2천111건·4천507억원)에 대해서는 경찰에 직접 수사를 의뢰했다.","임대인, 즉 집을 빌려주는 사람은 총 200명이고, 그들이 받은 돈은 6천925억 원이에요. 정부는 이 중에서 26명의 임대인에 대해 경찰에 조사를 요청했어요. 이 26명은 2천111건의 문제와 관련이 있고, 그 금액은 4천507억 원이에요.","이런 임대인은 총 200명이에요. 그들이 내야 하는 돈은 6,925억 원이에요. 국토부는 이 중에서 26명이 경찰에 직접 조사해 달라고 요청했어요."
"그 결과, 감정평가액이 59형(전용면적 18평)의 경우, 4억6천만원 이상, 51형(전용면적 15평)은 4억1천만원 이상 등으로 각각 결정됐다.","그 결과, 59형(전용면적 18평)의 집은 4억6천만원보다 비싸게 평가됐고, 51형(전용면적 15평)의 집은 4억1천만원보다 비싸게 평가됐다는 뜻이에요.","결과에 따르면, 59형의 경우 4억6천만 원 이상, 51형의 경우 4억1천만 원 이상으로 감정평가액이 결정되었어요."
폐업 소상공인 5만명에 100만원씩…오늘부터 재도전장려금 신청,가게를 닫은 소상공인 5만 명에게 각각 100만 원을 지원해요. 오늘부터 다시 시작할 수 있도록 도와주는 돈을 신청할 수 있어요.,폐업한 작은 가게 5만 개에 100만원씩…오늘부터 재도전장려금을 신청할 수 있어요.
파주 3호선 연장 경제성 추가…통과 당초보다 1년 연기,"파주 3호선이 더 길어지는 계획이 생겼어요. 그런데 이 계획이 돈이 얼마나 드는지 다시 살펴보게 되었고, 그래서 이 일이 원래보다 1년 늦어지게 되었어요.",파주 3호선이 더 길어지기로 결정되었어요. 원래 계획보다 1년이 더 늦게 통과될 거예요.
