original,simplified_human,simplified_by_model
"해당 기업은 지난 2005년부터 공장부지 일부가 주거지역용도여서 기존 건축물은 재축만 가능, 공장 신·증축이 불가능, 고충을 제기, 시는 지난 2012년부터 본격적인 규제개혁 방안을 중앙부처와 수차례 협의, 지난 2014년 행안부 주관 경기지역 규제개혁 안건으로 채택되는 등 적극행정으로 지난 2015년 해당 기업과 상생발전을 위한 업무협약을 맺고 공장 증·개축문제를 해결해줬다. 신한일전기 측은 이후 지난 2016년 제조시설(공장) 1만4천31㎡를 증축했다.","이 회사는 2005년부터 공장이 있는 지역의 일부가 주거지역으로 지정되어 있어서, 기존 건물은 새로 지을 수 있지만 공장을 새로 짓거나 늘릴 수 없었습니다. 그래서 회사는 어려움을 겪었고, 시청은 2012년부터 이 문제를 해결하기 위해 여러 번 논의했습니다. 2014년에는 이 문제를 해결하기 위한 계획이 경기도에서 채택되었고, 2015년에는 이 회사와 함께 발전하기 위한 협약을 맺었습니다. 그 덕분에 공장 증축 문제를 해결할 수 있었습니다. 이후 2016년에는 이 회사가 공장을 14,031㎡(약 4,200평) 늘렸습니다.","해당 기업은 2005년부터 공장 부지 일부가 주거지역으로 사용되어야 해서 기존 건물은 새로 지을 수 없어요. 공장 신축이나 증축은 불가능해지고, 고충을 겪고 있어요. 그래서 지난 2012년부터 정부가 이 문제를 해결하기 위한 방법을 중앙부처와 여러 번 이야기했어요. 2014년에는 행정부가 주관한 경기지역 규제개혁 안건으로 포함되었고, 이후 2015년에는 중앙부처와 협의해서 해결책을 찾았어요. 그래서 신한일전기 측은 2016년에 공장 1만4천31㎡를 새로 지었어요."
"이런 가운데 시는 전략환경영향평가도 병행해 개발제한구역 해제를 노리고 있다. 지난 4월 R&D 사이언스파크와 관련한 전략환경영향평가 초안을 주민들한테 공개, 의견을 수렴한 시는 이와 관련한 본안을 만들어 환경부에 상정했다. 지난 5월 말 환경부의 보완 의견을 받은 시는 수정 작업을 진행 중이다.","이런 상황에서 시청은 개발제한구역을 해제하기 위해 환경에 미치는 영향을 평가하는 작업도 함께 하고 있어요. 지난 4월에는 R&D 사이언스파크와 관련된 환경 영향 평가 초안을 주민들에게 보여주고, 그들의 의견을 들었어요. 그 후, 시청은 이 내용을 바탕으로 본안을 만들어 환경부에 제출했어요. 그리고 지난 5월 말에는 환경부에서 보완해야 할 점에 대한 의견을 받아서 지금 수정 작업을 하고 있어요.","이런 상황에서 시는 환경에 미치는 영향을 평가하고 개발 제한을 없애려고 노력하고 있어요. 지난 4월 R&D 사이언스파크 관련해서 환경 영향 평가 초안을 주민들에게 공개했어요. 그 주민들의 의견을 듣고 나서, 시는 이 내용을 수정해서 환경부에 제출했어요. 지난 5월 말 환경부에서 보완 의견을 받은 후, 시는 이 내용을 다시 고쳐서 환경부에 다시 제출할 거예요."
유진규 인천경찰청장은 “지역주민들이 체감할 수 있는 안전한 치안유지를 위해 체계적인 범죄예방 환경설계(CPTED) 사업을 하면서 범죄취약지 등에 대한 순찰을 강화하겠다”고 했다.,"유진규 인천경찰청장은 “우리 동네 사람들이 안전하다고 느낄 수 있도록 범죄를 예방하는 방법을 잘 계획하고, 위험한 곳을 더 자주 순찰하겠다”고 말했습니다.","유진규 인천경찰청장은 “지역 주민들이 느끼는 안전한 환경을 만들기 위해, 범죄를 예방하기 위한 계획을 세우고, 범죄가 잘 일어나는 곳을 더 많이 살펴볼 것”이라고 말했습니다."
춘천시가 레고랜드 주차장 인근에 695개 점포가 입점할 수 있는 대규모 판매시설의 건축 허가를 반려했다. 이에따라 그동안 지역 상권이 거세게 반발하며 논란이 됐던 대규모 판매시설 신축은 사실상 무산됐다.,춘천시가 레고랜드 주차장 근처에 695개의 가게가 들어설 수 있는 큰 건물 짓는 허가를 거부했어요. 그래서 그동안 지역 상점들이 반대하며 논란이 많았던 이 큰 건물 짓기는 이제 사실상 없어지게 되었어요.,춘천시가 레고랜드 주변에 695개의 가게를 만들 수 있는 큰 판매시설을 허락하지 않았어요. 그래서 그동안 지역 상점이 반대하며 논란이 있었던 대규모 판매시설이 건립되지 못했어요.
모바일 원주사랑상품권 및 신용·체크카드 온라인 신청자에게는 최대 5일 이내 순차적으로 지원금이 충전된다.,"모바일 원주사랑상품권과 신용카드 또는 체크카드를 온라인으로 신청하면, 최대 5일 안에 지원금이 차례대로 충전돼요.",모바일 원주사랑상품권과 신용카드 온라인으로 신청한 사람들에게는 최대 5일 동안 순차적으로 지원금이 들어갈 거예요.
"국토교통부에 따르면 올 2월 기준 도내 미분양 아파트는 1,498세대로 집계됐다. 전월보다는 68세대 줄어드는 데 그쳤다. 지난해 1분기(1~3월) 감소 폭이 300세대 수준이었던 점을 감안하면 분양경기가 예년만 못 했던 셈이다. 지역별로는 삼척이 17세대 줄어든 77세대로 감소 폭이 가장 컸다. 속초(74세대), 철원(125세대), 강릉(135세대)은 12세대, 8세대, 7세대씩 감소했다.","국토교통부에서 발표한 내용에 따르면, 올해 2월에 우리 지역에서 팔리지 않은 아파트가 1,498채라고 해. 지난 달보다 68채가 줄어든 거야. 작년 1분기(1월부터 3월까지)에는 300채가 줄어들었던 걸 생각하면, 올해는 아파트가 잘 팔리지 않는 것 같아. 지역별로 보면, 삼척에서 17채가 줄어들어 77채가 남았고, 속초는 74채, 철원은 125채, 강릉은 135채에서 각각 12채, 8채, 7채가 줄어들었어.","국토교통부에 따르면, 올해 2월에 우리 지역에서 팔리지 않은 아파트가 1,498채라고 해. 이건 작년 1분기보다 68채 줄어든 숫자야. 작년 1분기(1월~3월) 동안 아파트가 줄어든 것은 300채 정도였으니까, 올해는 작년보다 많이 줄어든 것은 아니라는 뜻이야.

지역별로 보면 삼척이 17채 줄어든 77채로 가장 많이 줄어들었고, 속초(74채), 철원(125채), 강릉(135채)도 각각 12채, 8채, 7채씩 줄어들었다."
"삼부르네상스 측은 기존 아파트와 달리 테라스 등 서비스 공간이 많이 제공돼 분양가가 높다고 설명하고 있다. 같은 기간 청약을 진행하는 효자동 ‘하우스디 시그니처98’은 총 98세대 규모로 106㎡형 96세대, 206㎡형 2세대로 조성된다. 이 중 206㎡형은 공급가가 17억7,820만원에 달한다. 공급면적은 272㎡로 3.3㎡당 분양가는 2,150만원 선이다. 올 3월 속초시 조양동 A아파트가 12억3,000만원에 거래되며 역대 최고 실거래가를 기록한 점을 감안하면 그보다도 당초 분양가가 5억원 이상 높다.","삼부르네상스는 다른 아파트들과 다르게 테라스 같은 편의 시설이 많이 있어서 가격이 더 비싸다고 설명하고 있어요. 같은 시기에 청약을 받는 효자동의 '하우스디 시그니처98'은 총 98세대로, 106㎡ 크기의 아파트가 96세대, 206㎡ 크기의 아파트가 2세대 있어요. 206㎡ 크기의 아파트는 가격이 17억7,820만원이에요. 이 아파트의 면적은 272㎡이고, 3.3㎡당 가격은 2,150만원 정도예요. 올해 3월에 속초시 조양동의 A아파트가 12억3,000만원에 팔리면서 가장 비싼 가격을 기록했는데, 이 아파트의 가격은 그보다도 5억원 이상 더 비싸요.","삼부르네상스 측은 기존 아파트와 달리, 테라스 같은 공간이 많아서 가격이 더 높다고 말하고 있어요. 같은 기간 동안 효자동 ‘하우스디 시그니처98’은 총 98세대가 들어서면서 106㎡형 96세대가, 206㎡형 2세대가 만들어질 거예요. 이 중 206㎡형은 106㎡보다 가격이 더 비싸요. 이 아파트의 공급 면적은 272㎡로, 3.3㎡당 분양가는 2,150만원이에요.

올해 3월 속초시 조양동 A아파트가 12억 3,000만원에 거래되었어요. 이는 지금까지의 최고 거래 가격보다도 더 높아요. 그래서 이 아파트의 가격은 원래 분양가가 5억원 이상 높다는 뜻이에요."
"현재 한국(1.75%)과 미국(1.50∼1.75%)의 기준금리 격차는 0.00∼0.25%p인데, 13일 금통위가 0.25%p만 올리면 미국 연방준비제도(연준·Fed)가 빅 스텝만 밟아도 0.00∼0.25%포인트의 역전을 피할 수 없다.","현재 한국의 기준금리는 1.75%이고, 미국은 1.50%에서 1.75% 사이예요. 이 두 나라의 금리 차이는 0.00%에서 0.25% 사이입니다. 만약 13일에 한국의 금리위원회가 금리를 0.25% 올리면, 미국의 중앙은행이 큰 폭으로 금리를 올려도 한국과 미국의 금리 차이를 없앨 수 없게 됩니다.","현재 한국의 기준금리가 1.75%이고, 미국은 1.50∼1.75%로 다르지만, 13일 금통위가 0.25%만 올리면 미국 연방준비제도(연준)가 큰 변화를 내야 할 수도 없어요. 0.25%만 올린다면, 미국은 0.00%에서 0.25%포인트씩 올릴 수밖에 없어요."
"앞서 시는 현행 최대 1,300%에 달하는 일반상업지역의 용적률을 최대 800%로 낮추기 위한 방안으로 일반상업 지역의 용적률을 하향 조정하는 방안등에 대해 검토하기도 했다.","앞서 시에서는 일반상업지역의 건물 높이를 정하는 규칙인 '용적률'을 지금의 최대 1,300%에서 800%로 낮추는 방법을 생각해봤습니다. 그래서 일반상업지역의 용적률을 줄이는 방법에 대해 검토했습니다.","앞서 시청은 현재 일반상업 지역의 용적률이 최대 1,300%로 높아져 있지만, 최대 800%로 낮추는 방법을 생각해봤어요."
"이에 대해 심호연 국장은 “업계의 의견을 심도 있게 검토해 타당성이 있다고 판단될 경우 향후 제도 개선, 조직개편에 적극 반영할 방침”이라고 답변했다. 한편 시 건설교통국은 지난 8일 공간정보산업협회와의 간담회에 이어 도시계획 엔지니어링 업체 등과도 만나 인허가 행위 개선 방안을 모색할 예정이다.","심호연 국장은 “업계의 의견을 잘 듣고, 그 의견이 맞다고 생각되면 앞으로 제도를 개선하고 조직을 바꿀 계획입니다.”라고 말했습니다. 한편, 시의 건설교통국은 지난 8일에 공간정보산업협회와 이야기를 나눈 후, 도시계획을 하는 회사들과도 만나서 허가 절차를 더 좋게 만드는 방법을 찾을 예정입니다.","심호연 국장은 “업계의 의견을 잘 살펴보고, 그 결과가 합리적이라고 판단되면 앞으로 제도나 조직을 개선하고 반영할 계획입니다.”라고 대답했어요. 한편 시의 건설교통국은 지난 8일에 공간 정보 산업 협회와 만나서 도시 계획 전문가와 이야기를 나누고, 허가를 더 잘 처리할 수 있도록 방법을 논의할 예정이에요."
"투기과열지구나 조정대상지역으로 지정되면 부동산 거래 시 주택담보대출 등과 같은 대출 규제는 물론 주택 청약, 분양권 전매 등 각종 제약을 받게 된다. 도내 조정대상지역으로는 고양·과천·광명·광주·구리 등 25개 시·군이 선정돼 있다. 투기과열지구는 성남시 수정·분당, 안산시 단원, 용인시 수지·기흥 등이다.","투기과열지구나 조정대상지역으로 지정되면 집을 사고팔 때 대출 규제가 생기고, 집을 사기 위한 청약이나 분양권을 팔 때도 여러 가지 제한이 생겨요. 우리 지역에서 조정대상지역으로 지정된 곳은 고양, 과천, 광명, 광주, 구리 등 25개 도시와 군이에요. 투기과열지구는 성남시의 수정구와 분당구, 안산시의 단원구, 용인시의 수지구와 기흥구 같은 곳이에요.","투기과열지구나 조정대상지역으로 지정되면, 집을 사거나 팔 때 돈을 빌릴 때 제한이 생길 수 있어요. 특히 집을 사거나 팔 때 돈을 빌릴 때 특별한 규정이 있을 수 있어요. 조정대상지역은 고양, 과천, 광명, 광주, 구리 등 25개의 지역이 선정되었어요. 투기과열지구는 성남시 수정·분당, 안산시 단원, 용인시 수지·기흥 등에서, 조정대상지역은 고양, 과천, 광명, 광주, 구리 등에서 선정되었어요."
올해 들어 고금리 여파와 집값 하향세로 부동산 시장이 위축되자 건설사들이 분양속도를 조절하면서 물량이 계속해서 이월 된 여파다.,"올해는 금리가 높아지고 집값이 떨어지면서 부동산 시장이 어려워졌어요. 그래서 건설 회사들이 집을 파는 속도를 늦추고, 그로 인해 판매하지 못한 집들이 계속 쌓이고 있는 상황이에요.",올해 들어서 돈이 비싼만큼 집값이 내려가면서 건설회사들이 집을 팔지 않거나 팔 때가 점점 늘어났어요. 그래서 앞으로 집을 팔고 싶어하는 사람들이 더 늘어난 상황이에요.
"그러면서 “(지금은) 부동산 시장 침체를 걱정하는 형국”이라며 “가뜩이나 지금 공시가격 상향 조정, 세율 인상 등으로 종부세 부담이 과중한 상황에서 최근 집값도 하락하는데 중과 체계를 가져가는 건 맞지 않는다”라고 지적했다.","""지금은 부동산 시장이 어려운 상황이라고 걱정하고 있어요. 집의 가격이 올라가고 세금도 더 많이 내야 하는데, 최근에 집값이 떨어지고 있어서 더 힘들어지고 있어요. 이런 상황에서 더 많은 세금을 내게 하는 건 맞지 않다고 말하고 있어요.""","그러면서 “지금 부동산 시장이 안 좋아질 걱정하는 사람들은 있다”라고 말했어요. “하지만 지금 집 가격이 올라가고 세금이 높아지면서 종부세가 너무 많이 들어가는 상황에서, 최근 집값이 떨어지고 있는 것은 맞지 않는다”라고 덧붙였어요."
하지만 공공지원 민간임대주택은 과천 시민의 주거안정과 내집 마련에 크게 기여할 수 있는데도 분양전환 여부에 대한 의무규정이 없어 10년 임차기간 종료 후 민간사업자가 분양 전환 여부 등을 결정하는 구조로 돼 있다. 이로 인해 과천 시민의 주거 불안정이 지속되고 향후 상승한 주택가격으로 인해 대규모 분쟁도 우려되고 있다.,"하지만 공공지원 민간임대주택은 과천에 사는 사람들이 안정적으로 살고, 집을 마련하는 데 큰 도움이 될 수 있어요. 그런데 이 주택이 10년이 지나면 어떻게 될지에 대한 규칙이 없어서, 민간사업자가 그때 가서 집을 팔지 말지를 결정하게 돼요. 이 때문에 과천에 사는 사람들은 계속해서 집에 대한 불안감을 느끼고 있고, 앞으로 집값이 오르면 큰 문제가 생길 수도 있어요.","하지만 공공지원 민간임대주택은 과천 시민들이 안전하게 살 수 있도록 도와줄 수 있는데, 하지만 임대 계약을 바꾸는 것에 대한 규칙이 없어서 10년 동안 임대 계약이 끝난 후 민간 사업자가 임대 전환을 결정할 수밖에 없는 구조가 되어 있어요. 그래서 과천 시민들이 집값이 오르면 큰 분쟁이 생길 수 있다는 걱정이 커지고 있어요."
"여기에 전날 미국 뉴욕증시에서 다우존스30 산업평균지수(-1.10%), 스탠더드앤드푸어스(S&P) 지수(-1.20%), 나스닥지수(-1.35%)가 모두 하락하고, 애플이 52주 신저가를 기록한 것도 투자 심리에 악영향을 미쳤다.","어제 미국 뉴욕의 주식 시장에서 다우존스30 지수는 1.10% 떨어졌고, 스탠더드앤드푸어스(S&P) 지수는 1.20% 하락했으며, 나스닥 지수는 1.35% 줄어들었어요. 그리고 애플의 주가는 1년 중 가장 낮은 가격을 기록했는데, 이 때문에 사람들이 주식에 대한 걱정이 커졌어요.","전날 뉴욕에서 다우존스 30 지수가 -1.10% 떨어졌고, 스탠더드앤드푸어스 지수는 -1.20% 떨어졌어요. 나스닥 지수도 -1.35% 떨어졌어요. 이 모든 것들이 하락하면서 투자자들이 겁을 먹고 있는 상황이에요. 특히 애플이 52주 동안 가장 낮은 지수를 기록한 것도 투자자들의 불안감을 키웠어요."
"금통위는 지난해 8월부터 이날까지 기준금리를 아홉 차례, 총 2.75%포인트 인상했다. 2012년 이후 10년 만에 금리 수준이 가장 높아졌다. 주택담보대출과 신용대출 금리가 연내 최대 9%에 이를 것이라는 게 전문가들 전망이다. 그렇지 않아도 KB국민·신한·하나·우리·NH농협은행 등 5대 은행의 18일 기준 신용대출 금리 상단은 7.77%, 변동형 주택담보대출 금리 상단은 7.13%로 집계됐다. 변동형 주택담보대출 금리는 16일 기준 8.154%까지 치솟았다. 금리 인상으로 이른바 ‘영끌족’, ‘빚투족’들은 대출 금리가 또다시 올라 타격을 입을 전망이다. 한국은행에 따르면 집을 팔아도 빌린 대출을 모두 갚지 못하는 금융부채 고위험군의 대출잔액만 2021년 말 현재 38만1,000가구, 69조4,000억원에 이른다. 언제 터질지 모를 시한폭탄을 해소할 수 있는 재정 금융대책이 필요하다.","금융통화위원회는 지난해 8월부터 지금까지 기준금리를 아홉 번 올렸어요. 그래서 지금 금리가 2.75%포인트 높아졌고, 이는 2012년 이후로 가장 높은 수준이에요. 전문가들은 주택담보대출과 신용대출의 금리가 올해 최대 9%까지 올라갈 것이라고 예상하고 있어요. 

현재 KB국민은행, 신한은행, 하나은행, 우리은행, NH농협은행 같은 큰 은행들의 신용대출 금리는 7.77%이고, 변동형 주택담보대출 금리는 7.13%로 나타났어요. 변동형 주택담보대출 금리는 16일 기준으로 8.154%까지 올랐어요. 

금리가 오르면서 ‘영끌족’과 ‘빚투족’이라는 사람들이 대출 금리 때문에 어려움을 겪을 것으로 보입니다. ‘영끌족’은 집을 사기 위해 모든 돈을 끌어모은 사람들을, ‘빚투족’은 빚을 내서 투자하는 사람들을 뜻해요. 

한국은행에 따르면, 집을 팔아도 빌린 돈을 다 갚지 못하는 위험한 상황에 있는 가구가 2021년 말 기준으로 38만 1,000가구, 즉 69조 4,000억 원에 달한다고 해요. 이런 문제를 해결하기 위해서는 재정 금융대책이 필요해요.","금통위는 작년 8월부터 지금까지 3번, 총 2.75% 올려왔어요. 이건 10년 만에 가장 높은 금리예요. 주택담보대출과 신용대출의 금리가 올해 안에 최대 9%까지 오를 것이라고 전문가들이 예상하고 있어요. 만약 그렇지 않더라도, KB국민은행, 신한은행, 하나은행, 우리은행, NH농협은행 같은 5개의 은행의 18일 기준 신용대출 금리 상단은 7.77%이고, 변동형 주택담보대출 금리 상단은 7.13%로 나왔어요.

변동형 주택담보대출 금리는 16일 기준 8.154%까지 올라갔어요. 금리가 올라가면 이른바 ‘영끌족’이나 ‘빚투족’ 같은 사람들이 대출을 갚기 힘들어질 수 있어요. 한국은행에 따르면, 집을 팔아서 빌린 대출을 모두 갚지 못하면 금융부채가 위험한 상태에 놓일 수 있는 집이 2021년 말"
"■건설경기에 미치는 영향=이 같은 건설자재 가격 급등은 건설사의 수익성을 악화시키고 향후 건설경기 회복을 제약하는 요인으로 작용할 전망이다. 통상 공사수주금액이 사전에 결정된 상황에서 자재 가격이 상승할 경우, 기업들은 마진 축소, 공사 지연 등으로 대응하기 때문이다. 실제 대한건설협회에 따르면 지난해 3~4월 건설자재 수급 불안으로 공사가 중단된 현장은 50여곳에 달한 것으로 집계됐다. 특히 건설자재 가격 급등의 부정적 영향은 중소형 건설사에 더 집중될 것으로 관측된다. 주로 선 계약 형태로 건설자재를 구입하는 대형 건설사와 달리 필요할 때마다 소량으로 물건을 가져오는 중소형 건설사는 유통가격 변화에 직격탄을 맞을 수밖에 없다. 건설산업연구원의 ‘철근 유통 구조’ 자료에 따르면 제강사가 생산한 물량의 60%는 대형 건설사의 사전계약으로 조기 소진되며, 나머지 30~40% 물량만 유통상을 통해 중소형 건설사에 공급되는 실정이다.","건설경기에 미치는 영향

최근 건설 자재 가격이 많이 올라서 건설 회사들이 돈을 벌기 힘들어지고, 앞으로 건설 경기가 좋아지는 데 방해가 될 것이라고 예상하고 있어요. 보통 건설 프로젝트를 시작하기 전에 가격이 정해지는데, 자재 가격이 오르면 회사들은 이익이 줄어들거나 공사가 늦어지는 문제를 겪게 돼요. 실제로, 작년 3월과 4월에는 자재가 부족해서 50곳 이상의 건설 현장이 중단되었다고 해요.

특히, 작은 건설 회사들은 큰 회사들보다 더 큰 영향을 받을 것으로 보입니다. 큰 건설 회사들은 미리 계약을 해서 자재를 많이 사놓지만, 작은 회사들은 필요할 때마다 조금씩 사기 때문에 가격이 오르면 더 큰 타격을 받게 돼요. 한 연구에 따르면, 철강 회사가 만든 철근의 60%는 큰 건설 회사들이 미리 계약해서 사가고, 나머지 30~40%만 작은 건설 회사들에게 공급된다고 해요.","■건설경기에 미치는 영향=이런 건설자재 가격이 오르는 것은 건설 회사들이 돈을 벌기 힘들게 만들고, 앞으로 건설이 잘 돌아가지 않게 하는 요인이 될 것 같아요. 일반적으로 공사를 시작하기 전에 자재 가격을 미리 정해놓은 상황에서 자재 가격이 오르면, 건설 회사들은 돈을 벌기 더 힘들어지고, 공사를 미루거나 다른 방법을 찾아야 할 수 있어요. 대한건설협회에 따르면, 작년 3월과 4월에 건설자재 수급이 불안정해서 공사가 중단된 곳이 50곳이나 된다고 해요. 특히 자재 가격이 오르는 것은 중소형 건설사들에게 더 많이 영향을 줄 거예요. 주로 대형 건설사와 사전 계약을 통해 물건을 구입하는 중소형 건설사는 가격 변화에 쉽게 대응할 수 없어요. 대형 건설사는 필요할 때마다 작은 양으로 물건을 가져오는 중소형 건설사는 가격 변화에 따라 피해를 입을 수밖에 없어요. 건설산업연구원 자료에 따르면, 제강사가 생산한 물량의 60%는 대형 건설사의 사전 계약으로 빨리"
쌍용자동차가 기업회생절차 개시 1년6개월만에 법정관리를 졸업했다.,쌍용자동차가 회사가 어려운 상황에서 회복하기 위한 과정을 시작한 지 1년 6개월 만에 법원에서 관리받는 일을 끝냈어요.,쌍용자동차는 기업이 다시 일어설 수 있게 되기 위해 법을 시작한 지 1년 6개월 만에 법정관리를 끝냈어요.
횡성군은 거주지가 불분명한 사람도 기초연금 혜택을 누릴 수 있도록 거주불명등록 어르신 기초연금 수급 대상자 발굴을 위한 실태조사에 나선다고 23일 밝혔다.,횡성군에서는 주소가 없는 어르신들도 기초연금을 받을 수 있도록 조사하기로 했다고 23일에 발표했어요. 이 조사는 주소가 불분명한 어르신들이 기초연금을 받을 수 있는지 알아보는 거예요.,"횡성군은 집이 알려지지 않은 어르신들이 기초연금을 받을 수 있도록, 그들의 집을 찾아보고 기초연금을 받을 수 있도록 조사에 착수했다고 23일에 발표했어요."
이를 통해 유소년 영재교육부터 시민 누구나 이용할 수 있는 평생교육까지 지역주민 생애주기에 맞는 교육 서비스를 제공하겠다는 방침이다.,"이 계획은 어린이와 청소년을 위한 특별한 교육부터, 모든 시민이 언제든지 배울 수 있는 평생교육까지, 지역 주민들이 필요로 하는 교육 서비스를 제공하겠다는 뜻이에요.",이를 통해 유소년 영재 교육부터 시민들이 모두 이용할 수 있는 평생 교육까지 지역 주민들이 필요로 하는 교육을 제공하겠다는 계획이에요.
2022년 7월 1일 기준 개별공시지가는 10월 31일 결정·공시된다.,2022년 7월 1일에 정해진 땅의 가격은 10월 31일에 발표되고 알려질 거예요.,2022년 7월 1일에 집값이 결정되고 공시될 거예요.
