original,simplified_human,simplified_by_model
경찰은 “서민의 주거권을 침해하는 전세 사기를 엄정히 단속하겠다”며 “다액 편취와 조직적 불법 행위에 대한 신고와 제보를 부탁드린다”고 말했다.,"경찰은 “서민의 집을 빼앗는 전세 사기를 엄격하게 단속하겠다”고 말하며, “큰 돈을 사기당하거나 여러 사람이 함께 하는 불법 행동에 대해 신고해달라”고 부탁했습니다.",경찰은 “서민들이 집을 빌릴 수 있는 권리를 침해하는 전세 사기를 철저히 단속하겠다”고 말했습니다. 그리고 “많은 돈을 빼앗거나 조직적으로 불법적인 행동에 대한 보고와 제보를 부탁드립니다.”라고 요청했습니다.
대종회 측은 “재개발사업 초기부터 추원재 보존을 원했고 사업지 제외를 요구했다. 지난 6월 추원재 철거에 반대하는 1만7천여명의 서명부를 제출하기도 했다”며 “그런데도 시는 조합원의 4분의 3이 찬성했다는 이유로 강제 수용을 결정했다”고 주장했다.,"대종회는 “우리는 재개발 사업이 시작될 때부터 추원재를 지키고 싶었고, 이곳에서 빼달라고 요구했어요. 지난 6월에는 추원재를 없애지 말라는 1만7천 명의 서명을 모아서 제출했어요. 그런데도 시청은 조합원 4명 중 3명이 찬성했다는 이유로 강제로 뺏기로 결정했어요”라고 말했어요.","대종회 측은 “재개발사업을 시작할 때부터 추원재를 지키려고 했고, 사업을 제외하라고 요구했다. 지난 6월에 추원재를 없애라고 반대하는 1만7천 명의 서명을 제출하기도 했다”라고 말했습니다. “하지만 시청은 조합원의 4분의 3이 찬성해서 강제적으로 수용했다”고 주장하고 있습니다."
"이어 “금리 인상과 가격 고점에 대한 인식으로 주택 매수심리가 위축된 가운데, 매수자와 매도자 간 거래 희망 가격 괴리로 거래량도 역대 최저 수준을 나타내고 있다”고 지적했다.","""금리가 높아지고 물건 가격이 비싸다는 생각 때문에 집을 사려는 사람들이 줄어들고 있어요. 그래서 집을 사고 싶어하는 사람과 팔고 싶어하는 사람 사이에 가격 차이가 커져서, 집 거래가 아주 적게 이루어지고 있다고 했어요.""","""금리가 오르고 집값이 높아지면서 사람들이 집을 사려고 하는 마음이 줄어들고 있어요. 하지만 집을 사고 파는 사람들과 집을 파는 사람들 사이에서 가격이 너무 낮아져서 거래가 많이 줄어들고 있어요."""
인천 중구가 지역 내 모든 주민을 대상으로 자전거 보험을 자동으로 가입해 주는 등 자전거 인프라 구축에 나섰다.,인천 중구에서는 모든 주민들이 자전거를 탈 때 안전하게 보호받을 수 있도록 자전거 보험에 자동으로 가입해 주기로 했어요. 이렇게 해서 자전거를 더 안전하게 탈 수 있는 환경을 만들고 있어요.,"인천 중구는 지역 주민들에게 자전거 보험을 자동으로 가입해 주기로 했어요. 이렇게 해서 자전거를 탈 수 있도록 도와주고, 자전거를 더 많이 이용할 수 있도록 만들려고 노력하고 있어요."
"태백시는 2020년에 도입된 탄탄페이가 11월 현재 가맹점 수 2,500여개소, 누적 카드 등록수 4만3,000여개, 누적 사용량 1,500억원이 넘어가며 태백시민과 지역 소상공인에게 없어서는 안될 소비수단으로 자리잡았다고 16일 밝혔다.","태백시는 2020년에 시작된 '탄탄페이'라는 결제 방법이 11월 현재 2,500개 이상의 가게에서 사용되고 있고, 지금까지 43,000개 이상의 카드가 등록되었으며, 총 사용 금액이 1,500억 원이 넘었다고 16일에 발표했어요. 이 결제 방법은 태백시민과 지역의 작은 가게들에게 아주 중요한 소비 수단이 되었다고 해요.","태백시는 2020년에 도입한 탄탄페이가 11월에 현재 가맹점 2,500개와 카드 등록 43,000개, 사용량 1,500억 원이 넘는 것으로 확인되었어요. 탄탄페이는 태백시민과 지역 소상공인들에게 꼭 필요한 소비 방법이에요."
[삼척]삼척시 도계광업소 부지 매입 난항,[삼척]삼척시에서 도계광업소 부지를 사려는데 어려움을 겪고 있어요.,[삼척] 삼척시 도계광업소 땅을 사는 일이 어려워지고 있어요.
한국가스공사가 가스를 비싸게 사와 저렴하게 팔면서 떠안은 손실이 5조원을 넘어서자 정부가 도시가스 요금 인상 방침을 정하고 현재 내부적으로 인상 폭을 협의하고 있다.,"한국가스공사는 가스를 비싼 가격에 사서 싸게 팔고 있어서 5조 원이 넘는 큰 손해를 보고 있어요. 그래서 정부는 도시가스 요금을 올리기로 결정하고, 지금 그 요금을 얼마나 올릴지 논의하고 있어요.","한국가스가 가스를 비싸게 사는 것과 저렴하게 팔아서 생긴 돈이 5조 원을 넘어서자, 정부가 도시가스 요금을 올릴 계획을 세우고, 지금 내부적으로 요금을 어떻게 올릴지 논의하고 있어요."
정하영 시장은 “한강시네폴리스가 대한민국 4차산업과 문화콘텐츠 중심거점으로 발돋움하게 될 것으로 기대된다”고 말했다.,정하영 시장은 “한강시네폴리스가 한국의 4차 산업과 문화 콘텐츠의 중요한 중심지가 될 것이라고 기대하고 있다”고 말했습니다.,정하영 시장은 “한강시네폴리스가 대한민국 4차산업과 문화콘텐츠의 중심지로 성장할 것이라고 기대하고 있다”고 말했습니다.
특히 시는 이 과정에서 ‘주거생활권계획’ 도입 여부를 고민할 예정이다. 현행 절차는 시장이 이러한 계획을 토대로 정비예정구역을 지정하면 해당 지역 주민들이 조합설립인가 등을 거쳐 재건축·재개발과 같은 정비사업을 추진하는 구조다.,"특히, 시에서는 '주거생활권계획'을 도입할지 고민할 거예요. 지금은 시장이 이런 계획을 바탕으로 정비할 지역을 정하면, 그 지역 주민들이 모여서 조합을 만들고, 그 후에 재건축이나 재개발 같은 사업을 진행하는 방식이에요.","특히, 시는 앞으로 '주거생활권계획'을 만들어보는 일을 생각할 거예요. 지금의 방법은 시장이 정한 계획에 따라 지역을 정리하고 정비사업을 진행하는 거예요."
금리 인상기 주거 안정망을 강화하기 위해 내년부터 안심전환대출(주택가격 6억원 이내·대출한도 3.6억원)과 적격대출(9억원 이내·한도 5억원)을 기존 보금자리론에 통합한 ‘특례보금자리론’으로 운영한다.,"내년부터 집을 사거나 빌릴 때 더 안전하게 돈을 빌릴 수 있도록 새로운 대출 제도가 생길 거예요. 이 제도는 '특례보금자리론'이라고 불리며, 집값이 6억 원 이하인 경우에는 최대 3.6억 원까지, 9억 원 이하인 경우에는 최대 5억 원까지 돈을 빌릴 수 있어요. 이렇게 해서 사람들이 집을 더 쉽게 구할 수 있도록 도와줄 거예요.","내년부터는 집 가격이 6억 원 이하이고, 대출 한도가 3.6억 원으로 늘어난 '특례보금자리론'을 운영할 거예요. 이 보금자리론은 집을 사거나 사고 싶을 때, 9억 원까지 대출을 받을 수 있는 제도예요."
"앞서 강원도는 GJC가 레고랜드 테마파크 조성사업을 추진하기 위해 2020년 BNK투자증권을 통해 2,050억원 규모의 자산유동화기업어음(ABCP)을 발행할 때 채무 보증을 섰다. GJC가 레고랜드 건설 자금 조달을 위해 설립한 특수목적법인 아이원제일차의 2,050억원 규모의 ABCP는 만기일인 지난달 29일까지 상환되지 못해 지난 4일 최종 부도 처리됐다.","강원도는 GJC라는 회사가 레고랜드 테마파크를 만들기 위해 2020년에 BNK투자증권이라는 곳을 통해 2,050억원이라는 큰 돈을 빌릴 수 있도록 도와주었어요. 이 돈은 특별한 목적을 위해 만든 회사인 아이원제일차가 빌린 건데, 이 돈을 갚아야 하는 날인 지난달 29일까지 갚지 못해서, 결국 4일에 돈을 못 갚은 것으로 결정되었어요.","강원도는 GJC가 레고랜드 테마파크를 만들기 위해 2020년에 BNK투자증권을 통해 2,050억 원짜리 돈을 빌린다고 발표했어요. 이 돈은 만기가 지난 29일까지 돈을 갚지 못해서, 지난 4일에 최종적으로 돈을 갚지 못했다는 사실이 밝혀졌어요."
화천군이 화천사랑상품권 활성화를 위해 적극 나선다.,화천군은 화천사랑상품권을 많이 사서 사용할 수 있도록 노력하고 있어요.,화천군이 화천사랑상품권을 더 잘 사용하도록 도와주기로 했어요.
"11일 군포시와 재개발추진위 등에 따르면 이들 구역은 사전 검토과정에서 생활권 중심으로 추진 중인 정비기본계획안과의 정합성과 적정성, 인접 구역과 연계한 도로망과 도로폭 조정, 공원녹지 등의 효율적 배치, 공공생활시설의 구역별 적정 배분 등이 검토된 것으로 파악됐다.","11일 군포시와 재개발 추진 위원회에 따르면, 이 지역은 사전 검토 과정에서 사람들이 살기 좋은 환경을 만들기 위한 계획과 잘 맞는지, 주변 도로와 연결이 잘 되는지, 공원과 녹지를 어떻게 잘 배치할지, 그리고 공공시설을 각 구역에 적절하게 나누는 방법 등을 검토했다고 합니다.","11일에 군포시와 재개발추진위에 따르면, 이 지역은 미리 검토를 해보고, 생활과 관련된 계획을 세우고 있는 것으로 보입니다. 이 계획은 주변 지역과 잘 맞는지, 도로와 도로 폭이 적절한지, 공원과 녹지가 잘 배치되는지 등을 살펴봤습니다. 그리고 공공생활시설이 필요한 지역에 적절하게 분배되는 것도 확인했습니다."
오늘부터 가스 요금 인상 가구당 월 평균 860원 올라,오늘부터 가스 요금이 올라요. 이제 한 달에 집마다 평균 860원이 더 내야 해요.,"오늘부터 가스 요금이 올라서, 한 가구에 매달 평균 860원이 더 오를 거예요."
횡성 이모빌리티 클러스터와 인제 경량소재·튜닝 클러스터를 중심으로 한 산업 고도화에 나설 계획이다.,횡성에 있는 이모빌리티 클러스터와 인제에 있는 가벼운 소재와 튜닝 클러스터를 중심으로 산업을 더 발전시키려고 계획하고 있어요.,횡성에서 이모빌리티 클러스터와 인제에서 경량 소재와 튜닝 클러스터를 중심으로 산업을 발전시키려고 합니다.
강원도 소비자심리지수가 두달 연속 상승세를 기록했다. 경기 심리 개선에 대한 기대감이 나오고 있다.,강원도에서 사람들이 물건을 사는 기분이 두 달 연속으로 좋아지고 있어요. 사람들이 앞으로 경제가 더 나아질 거라고 기대하고 있다는 뜻이에요.,강원도에서 물건을 사는 사람들의 마음이 두 달 연속으로 좋아지고 있어요. 사람들이 물건을 사려고 기대하고 있어요.
한편 공동주택 공시가격안은 다음 달 12일까지 소유자와 지방자치단체 등으로부터 의견을 듣고 중앙부동산가격공시위원회의 심의를 거쳐 내달 29일 확정·공시될 예정이다.,"공동주택의 가격에 대한 계획은 다음 달 12일까지 집주인과 지방정부의 의견을 듣고, 중앙부동산가격공시위원회에서 검토한 후 다음 달 29일에 확정되고 발표될 예정이에요.","한편 공동주택 공시가격안은 다음 달 12일까지 소유자와 지방자치단체 등에서 의견을 듣고, 중앙부동산가격공시위원회의 심의를 거쳐 내달 29일에 최종적으로 결정되고 공개될 예정이에요."
양주시가 일부 주민과 국민의힘 양주시당협이 주장하고 있는 옥정택지지구 내 대형 물류센터의 건축허가가 부당하다는 주장을 정면으로 반박했다.,"양주시가 일부 주민들과 국민의힘 양주시당협이 말하는 옥정택지지구에 있는 큰 물류센터의 건축허가가 잘못되었다고 주장하는 것에 대해 반박했습니다. 즉, 양주시는 그 주장이 틀렸다고 말한 것입니다.",양주시가 일부 주민들과 국민의힘 양주시당협이 주장하는 옥정택지 내 큰 물류센터를 허락하는 것이 잘못되었다고 분명히 반박했어요.
"분양 일정은 3일부터 22일까지 군청 홈페이지 및 온비드 시스템을 통해 입찰 공고하고, 입찰 공고와 같은 기간 내에 전자 입찰서를 제출할 수 있다. 개찰은 오는 25일, 낙찰자 발표는 28일이다.","아파트를 팔기 시작하는 날은 3일부터 22일까지이며, 군청 홈페이지나 온비드 시스템을 통해 입찰 공고가 될 거예요. 그 기간 안에 전자 입찰서를 제출할 수 있어요. 낙찰자 발표는 28일이고, 개찰은 25일에 이루어질 거예요.","분양이 시작되는 날은 3일부터 22일까지입니다. 분양을 신청할 수 있는 방법은 군청 홈페이지와 온비드 시스템을 이용할 수 있어요. 분양을 신청한 후 22일까지 전자 입찰서를 제출할 수 있습니다. 그리고 개찰은 25일, 낙찰자 발표는 28일에 이루어질 거예요."
그러나 A업체의 부지 매입 과정에서 김포고가 운동장 축소 등을 이유로 반대 의견을 내 주민들의 기대감은 산산조각날 위기에 처했다. 뿐만 아니라 사업이 진행되지 않은 채 오는 6월 도시계획시설 실효 연장 기한이 도달할 경우 국토의 계획 및 이용에 관한 법상 토지에 대한 강제 수용이 불가능해져 A업체가 사업을 포기할 수 있는 데다 시마저도 이곳을 우선 매입 순위에서 배제한 실정이다.,"A업체가 땅을 사는 과정에서 김포고 학생들이 운동장이 줄어드는 것에 반대하면서 주민들이 실망할 상황이 생겼어요. 게다가, 만약 6월까지 이 사업이 진행되지 않으면, 법 때문에 A업체가 땅을 강제로 살 수 없게 되고, 그래서 사업을 포기할 수도 있어요. 그리고 시청도 이 땅을 우선적으로 사지 않기로 결정했어요.","A업체가 땅을 사는 과정에서 김포고등학교 운동장 축소 때문에 주민들이 기대했던 일이 무너질 위기에 처했어요. 그리고 사업이 아직 진행되지 않은 상태에서 오는 6월에 도시 계획을 바꾸는 시간이 지나면 A업체가 사업을 끝내지 못할 수도 있고, 시마저도 이곳을 우선적으로 매입하지 않겠다고 했어요."
"동해시, 34억원 들여 신재생에너지시설 보급","동해시에서 34억 원을 사용해서 새로운 에너지를 만드는 시설을 만들기로 했어요. 이 시설은 태양열이나 바람 같은 자연 에너지를 이용해서 전기를 만들 수 있어요. 이렇게 하면 환경도 보호하고, 더 깨끗한 에너지를 사용할 수 있게 돼요.",동해시에서 34억 원을 들여서 새로운 에너지를 만드는 시설을 설치했어요.
인천에서 아파트나 오피스텔 전세사기를 당했다는 주민 고소가 무더기로 나와 경찰이 수사에 나섰다.,인천에서 아파트나 오피스텔을 빌리려고 했던 사람들이 사기를 당했다는 이야기가 많이 나왔어요. 그래서 경찰이 이 사건을 조사하기 시작했어요.,인천에서 아파트나 오피스텔을 전세로 빌린 사람들이 피해를 입었다는 소식이 많이 나오고 경찰이 조사에 나섰어요.
"해당 계획은 상급 지방자치단체인 경기도의 도시관리계획 정책기조를 수용, 변화하는 도시여건을 반영하고 불합리한 토지 이용 개선으로 지속 가능한 발전을 도모하기 위해 마련됐다.","이 계획은 경기도라는 큰 지역의 도시 관리 방법을 따르고, 도시의 변화에 맞춰서 더 나은 환경을 만들기 위해 만들어졌어요. 또한, 땅을 사용하는 방법을 더 합리적으로 바꿔서 앞으로도 계속 발전할 수 있도록 도와주려고 해요.",이 계획은 경기도의 도시 관리 계획을 따르면서 변화하는 도시를 위해 만들어졌어요. 이 계획은 불공정한 땅 사용을 줄여서 계속 발전할 수 있도록 도와줄 거예요.
이르면 다음주부터 분양가 12억원 이하 아파트도 중도금 대출을 받을 수 있게 된다.,다음 주부터 12억 원 이하의 아파트를 사는 사람들도 중도금 대출을 받을 수 있게 될 거예요. 중도금 대출은 집을 사기 위해 필요한 돈을 빌리는 방법 중 하나예요.,다음 주부터 12억원 이하의 아파트도 중도금 대출을 받을 수 있게 됩니다.
"중소벤처기업부는 이날부터 희망플러스 특례보증 대출한도를 확대하는 등 지역 신용보증재단의 주요 특례보증을 대폭 개편한다. 희망대출플러스는 매출 감소 소상공인을 대상으로 신용도에 따라 1~1.15% 금리로 경영지원금을 대출해주는 제도다. 현재 사업자별 보증금액 한도는 1,000만원이나 18일부터 한도가 2,000만원으로 높아진다. 지원대상도 현행 ‘방역지원금 수급자’에서 ‘손실보전금 수급자(중·저신용자)’까지 확대된다.","중소벤처기업부는 오늘부터 지역 신용보증재단의 특별 보증 제도를 크게 바꾸고, 희망플러스 대출의 한도를 늘리기로 했어요. 희망대출플러스는 매출이 줄어든 작은 가게를 도와주기 위해, 신용도에 따라 1%에서 1.15%의 낮은 이자로 돈을 빌려주는 제도예요. 지금은 사업자마다 최대 1,000만 원까지 빌릴 수 있지만, 18일부터는 이 한도가 2,000만 원으로 늘어납니다. 지원받을 수 있는 사람도 현재 '방역지원금을 받은 사람'에서 '손실보전금을 받은 사람(신용이 낮은 사람)'까지 확대돼요.","중소벤처기업부는 오늘부터 희망플러스 특례보증 대출 한도를 늘리고, 지역 신용보증재단의 중요한 특례보증을 크게 바꿀 거예요. 희망대출플러스는 매출이 줄어든 소상공인을 위해 1%에서 1.15%의 금리로 경영지원금을 대출해주는 제도예요. 지금은 사업자별로 한도가 1,000만원인데, 앞으로는 2,000만원으로 늘어난답니다. 지원 대상도 원래는 역사를 돌리는 돈을 받는 사람들만이었는데, 이제는 모든 소상공인에게 지원해줄 수 있게 되었어요."
주금공에 따르면 주택연금은 만 55세 이상의 고령층이 소유주택을 담보로 맡기고 매월 안정적인 노후자금을 받을 수 있도록 국가가 보증하는 금융상품이다.,"주금공에 따르면, 주택연금은 55세 이상인 어르신들이 자기 집을 담보로 맡기고 매달 안정적인 돈을 받을 수 있도록 정부가 도와주는 금융 상품이에요. 쉽게 말해, 어르신들이 집을 가지고 있으면서 필요한 돈을 매달 받을 수 있게 해주는 제도예요.","주금공에 따르면, 주택연금은 만 55세 이상에 집을 가진 사람들에게 매달 안정적인 돈을 받을 수 있도록 정부가 도와주는 금융 상품이에요."
"반찬 전문점을 이용하는 연령대도 높아졌다. 명절 전날 반찬전문점을 이용한 고객들의 연령대 비율을 보면 2019년 설의 경우 30대 이하가 47%, 50대 이상이 28.5%를 차지했다. 반면 올들어 지난 설에는 30대 이하 비중이 31.7%로 줄었고, 50대 이상 비중이 41.7%로 늘었다. 과거 50대 이상 소비자는 마트나 시장에서 재료를 구매해 직접 차례 음식을 만드는 경우가 많았지만, 최근 인식이 변화한 것으로 풀이된다.","반찬 전문점을 이용하는 사람들이 더 많아졌어요. 명절 전날 반찬 전문점을 이용한 사람들의 나이를 보면, 2019년 설날에는 30대 이하가 47%였고, 50대 이상은 28.5%였어요. 그런데 올해 설날에는 30대 이하가 31.7%로 줄어들고, 50대 이상은 41.7%로 늘어났어요. 예전에는 50대 이상 사람들이 마트나 시장에서 재료를 사서 직접 음식을 만들었지만, 요즘은 그런 생각이 바뀌었다고 할 수 있어요.","반찬 전문점을 이용하는 사람들이 나이가 높아지고 있어요. 2019년 설날에 반찬 전문점을 이용한 사람들 중에서 20대 이하가 47%, 50대 이상이 28.5%를 차지했어요. 반면, 올해 설날에는 30대 이하가 31.7%로 줄었고, 50대 이상이 41.7%로 늘었어요. 과거 50대 이상이 반찬을 직접 만들어 먹는 경우가 많았지만, 최근에는 사람들이 직접 요리하는 일이 줄어들고 있다는 뜻이에요."
또 올 하반기까지 도 예산 110억을 들여 670억원 규모의 추가 대출 지원을 한다.,올해 하반기까지 110억 원을 사용해서 670억 원 규모의 추가 대출을 도와줄 거예요.,"올해 하반기까지, 우리 지역의 예산으로 110억 원을 사용해서 670억 원의 추가 대출을 도와줄 거예요."
수도권 철근·콘크리트 셧다운…과천 건설현장 공사 중단 면해,수도권의 철근과 콘크리트를 사용하는 건설 작업이 멈췄어요. 하지만 과천에서는 공사가 계속 진행될 수 있게 되었어요.,수도권에서 철근과 콘크리트를 닫아서 공사를 중단시키고 있어요. 과천에서 건설 현장에서 공사를 계속하고 있어요.
한국부동산원에 따르면 지난 7월 강릉지역 외지인 매매 금액은 지난해 총 평균 거래금액 대비 44.2%에 그쳤다. 지난달엔 40.0%로 추가 하락했다.,"한국부동산원에 따르면, 지난 7월 강릉에서 외부 사람들이 집을 사는 금액이 작년의 평균 거래 금액보다 44.2% 낮았어요. 그리고 지난달에는 이 비율이 40.0%로 더 줄어들었답니다.","한국부동산원에 따르면, 지난 7월 강릉 지역에서 다른 나라 사람들이 집을 사거나 팔 때의 돈은 작년 평균 거래 금액의 44.2%에 불과했어요. 지난달에는 그 금액이 40.0%로 조금 더 낮아졌어요."
문제는 전세대출이 대부분 변동금리 대출이다 보니 차주 입장에서 금리 상승에 취약하다는 점이다.,"전세대출은 대부분 이자율이 변동하는 대출이어서, 대출을 받은 사람들은 이자율이 오르면 더 많은 돈을 내야 한다는 문제가 있어요.","문제는 전세대출이 대부분 변동금리 대출이라는 것이어서, 집을 사거나 다른 큰 돈을 빌릴 때 금리가 오를 때 큰 피해를 입을 수 있다는 거예요."
특히 시는 루원복합청사는 인근에 추진 중인 소상공인클러스터 및 인천지방국세청이 함께 들어서면 공공기관 집적화를 통한 효율성 강화는 물론 공공기능 시너지를 한층 더 높일 것으로 보고 있다. 시는 공공기관 등 입주로 인해 주민편의 향상은 물론 연간 40여만 명의 유동 인구가 발생해 지역 경제 활성화도 이뤄질 것으로 기대하고 있다.,"특히, 인천시는 루원복합청사 주변에 소상공인클러스터와 인천지방국세청이 들어오면 여러 공공기관이 함께 모여서 일을 더 잘할 수 있을 거라고 생각하고 있어요. 이렇게 되면 주민들이 더 편리하게 생활할 수 있고, 매년 40만 명 정도의 사람들이 이 지역을 방문하게 되어 지역 경제도 더 활발해질 것이라고 기대하고 있어요.","특히 시는 루원복합청사가 가까운 곳에 들어오면 공공기관들이 함께 모여서 효율을 높이고, 공공기능이 더 잘 작동할 것이라고 생각하고 있어요. 시는 공공기관들이 들어오면서 주민들이 더 편하게 살 수 있도록 돕고, 매년 약 40만 명의 사람들이 이 지역에 오를 것으로 기대하고 있어요. 이렇게 사람들이 많이 들어오면 지역 경제도 더 활발해질 거예요."
앞서 미추홀구에서는 1~2개 동으로 조성된 아파트나 오피스텔 건물이 법원 경매에 넘어가 세입자들이 전세금을 돌려받지 못한 사례가 속출했다.,"미추홀구에서는 1개 또는 2개 동으로 지어진 아파트나 오피스텔 건물이 법원 경매에 넘어가면서, 그곳에 살고 있는 세입자들이 전세금을 돌려받지 못하는 일이 많이 발생하고 있어요.","앞서 미추홀구에서는 1개 또는 2개 동으로 만들어진 아파트나 오피스텔이 법원에 팔렸고, 세입자들이 전세금을 돌려받지 못한 사례가 많이 발생했어요."
