original,simplified_human,simplified_by_model
"임대료 할인 대상은 현재 LH 임대상가에 입점해 영업 중인 소상공인, 중소기업, 비영리 민간단체, 사회복지법인, 임대주택단지 내 민간 어린이집 등 2천221곳이다. 할인율은 월 임대료의 25%다.","임대료 할인을 받을 수 있는 곳은 현재 LH 임대상가에서 가게를 운영하고 있는 작은 가게, 중간 규모의 회사, 비영리 단체, 사회복지 법인, 그리고 임대주택 단지 안에 있는 어린이집 등 총 2,221곳이에요. 이곳들은 매달 내는 임대료의 25%를 할인받을 수 있어요.","임대료 할인 대상은 현재 LH에서 임대해주고 있는 소상공인, 중소기업, 비영리 민간단체, 사회복지법인, 임대주택단지 내 민간 어린이집 등 총 2,221곳이에요. 이 할인율은 월에 내는 임대료의 25%예요."
그러면서 “해당 토지는 근저당 설정 이후에도 매도인 가족이 계속 관리·경작했고 일부를 빌려주고 임대료까지 받은 실질적인 소유주다. 검찰은 계약 후 1년 10개월이 지난 후의 감정평가액을 근거로 (내가) 엄청난 이익을 얻은 것처럼 호도하고 있다”고 부연했다.,"""그 땅은 근저당이라는 대출을 설정한 후에도 팔 사람의 가족이 계속 관리하고 농사를 지었으며, 일부는 다른 사람에게 빌려주고 임대료도 받았기 때문에 실제로 그 땅의 주인이라고 할 수 있어. 검찰은 계약이 끝난 지 1년 10개월이 지난 후에 땅의 가치를 평가해서 내가 큰 이익을 얻은 것처럼 잘못 말하고 있어.""","""그 땅은 원래 주인 가족이 계속 관리하고 경작했기 때문에, 일부를 빌려주고 임대료까지 받아서 소유한 사실이 있어요. 하지만 검찰은 계약이 생긴 지 1년 10개월이 지난 후에 그 땅의 가치를 보고, 엄청난 이익을 얻은 것처럼 속이고 있다고 말했어요."""
"인천e음은 인천연구원 연구 결과, 인천의 역외소비는 359억원 줄어드는 효과도 났다. 특히 2020년 한국지방행정연구원의 연구에서 경제적 편익이 3천566억원에 달하고, 지난해 한국시스템다이내믹스 학회의 연구에서 중·소상공인 매출이 최대 47.2%까지 늘어날 것으로 예측하는 등 정책적 효과도 나타나고 있다.","인천e음은 인천에서 사람들이 다른 지역에서 소비하는 돈이 359억 원 줄어들었다는 연구 결과가 있어요. 특히 2020년에 한국지방행정연구원에서 조사한 결과, 이 프로그램 덕분에 경제적으로 3천566억 원의 이익이 생길 수 있다고 했어요. 그리고 작년에는 한국시스템다이내믹스 학회에서 조사한 결과, 작은 가게와 상점의 매출이 최대 47.2%까지 늘어날 것이라고 예측했어요. 이런 것들이 인천e음의 좋은 효과를 보여주는 예시예요.","인천e음은 인천연구원 연구를 통해 인천의 외지에서 돈을 사용하는 것이 359억 원 줄어들었다는 결과를 보였습니다. 특히 2020년 한국지방행정연구원이 연구한 결과, 경제적으로 이득이 3천 566억 원이라고 보고했고, 지난해 한국시스템다이내믹스 학회 연구에서 중소기업 매출이 최대 47.2%까지 늘어날 것이라고 예상했습니다. 이 연구는 정책적으로도 좋은 결과를 보여주고 있습니다."
단기외채 비중이 높다는 우려에 대해서는 “과거 10년에서 크게 벗어나고 있지 않기에 걱정할 수준은 아니지만 저희가 보고 있다”고 말했다.,"""단기 외채가 많다는 걱정에 대해, '지난 10년 동안 큰 변화가 없어서 너무 걱정할 필요는 없지만, 우리는 계속 주의하고 있다'고 말했다.""","단기외채 비중이 높다는 걱정에 대해서는 ""과거 10년 동안 크게 바뀌지 않았기 때문에 걱정할 필요는 없어요""라고 말했습니다."
생애 최초 주택구입 보금자리론을 통해 LTV 80% 적용 받으려면 한국주택금융공사의 ‘생애최초 특례구입자금보증’ 요건에 부합해야 한다.,"처음으로 집을 사려고 할 때, '보금자리론'이라는 특별한 대출을 이용하면 집값의 80%까지 돈을 빌릴 수 있어요. 하지만 이 대출을 받으려면 한국주택금융공사에서 정해놓은 조건을 충족해야 해요.",생애 최초로 집을 사는 보금자리론을 이용하려면 한국주택금융공사가 정한 조건에 맞춰야 해.
인천시는 소상공인 사업장의 고용을 늘리고 골목상권 업종을 지원하기 위해 200억원의 경영안정자금 대출을 추진한다고 31일 밝혔다.,"인천시는 작은 가게들이 더 많은 사람을 고용할 수 있도록 도와주고, 골목에서 운영되는 가게들을 지원하기 위해 200억 원의 돈을 빌려주는 프로그램을 시작한다고 31일에 발표했어요.",인천시는 소상공인들이 일자리를 늘리고 골목상권에서 일하는 사람들을 도와주기 위해 200억 원을 빌려서 대출을 준비한다고 31일에 발표했어요.
시 관계자는 “단지 밖은 도시 및 주거환경정비 법에 따른 재개발·재건축 사례일뿐 일반주택 법에 따른 사업승인은 단 한건도 없다. 도로 건너편은 분명한 불법”이라고 밝혔다.,"관계자는 ""이 지역은 재개발과 재건축이 진행되고 있지만, 일반 주택을 짓기 위한 허가는 단 한 건도 없어요. 도로 건너편은 확실히 불법이에요.""라고 말했습니다.",시 관계자는 “단지 주변은 일반적인 재개발이나 재건축 사례일 뿐이에요. 하지만 일반 주택을 새로 짓거나 고치는 것은 아무것도 없어요. 그 옆에는 분명히 잘못된 도로가 있어요.”라고 말했습니다.
"더퍼스트타워 세교는 지하 2층, 지상 10층, 연면적 5만8천여㎡ 등의 규모로 지난해 2월 준공됐다.","더퍼스트타워 세교는 지하 2층과 지상 10층으로 이루어져 있고, 전체 면적이 5만8천 제곱미터 정도 되는 큰 건물이에요. 이 건물은 작년 2월에 완공되었어요.",더퍼스트타워 세교는 지하 2층과 지상 10층으로 이루어진 큰 건물이에요. 건물의 크기는 5만8천 제곱미터 정도예요. 이건 아주 큰 규모예요.
김광수 은행연합회장은 “고금리 상황과 위험 회피 성향에 따라 은행권으로 집중되는 자금이 대출과 자금 공급 등을 통해 실물 경제와 금융 시장에 다시 순환되도록 은행 본연의 역할을 강화하고 취약 계층 지원 등 사회적으로 은행권이 기대하는 역할도 충실히 수행하겠다”고 말했다.,"김광수 은행연합회장은 “요즘 금리가 높고 사람들이 위험을 피하려고 하면서, 많은 돈이 은행으로 모이고 있어요. 우리는 이 돈이 대출이나 다른 방법으로 다시 경제와 금융 시장에 돌아가게 도와줄 거예요. 그리고 어려운 사람들을 지원하는 등 은행이 해야 할 역할도 잘 수행하겠습니다.”라고 말했습니다.","김광수 은행연합회장은 “높은 이자 때문에 사람들이 돈을 빌리는 일이 많아지고, 돈을 빌려주는 일이 줄어들고 있는 상황에서, 은행이 돈을 더 잘 관리하고 사람들의 경제에 도움이 되도록 노력하겠다”고 말했습니다."
"김진태 지사는 “반도체 공약 실현을 위해 열심히 뛰고 있는데 기업의 생태계 구축을 위해 노력하고 있다”면서 “내년 중소기업경영안정자금 3,500억원을 편성했는데 이차보전 등 많은 지원을 할 계획인 만큼 중소기업인들이 기업 활동을 적극 펼치기 바란다”고 했다.","김진태 지사는 “반도체 산업을 발전시키기 위해 열심히 노력하고 있어요. 기업들이 잘 성장할 수 있도록 도와주고 있죠.”라고 말했습니다. 그리고 “내년에는 중소기업을 도와주기 위해 3,500억 원을 준비했어요. 이 돈으로 여러 가지 지원을 할 계획이니, 중소기업들이 활발히 활동하길 바랍니다.”라고 덧붙였습니다.","김진태 지사는 “반도체 공약을 실현하기 위해 열심히 일하고 있다”고 말했어요. 그리고 “내년 중소기업경영안정자금 3,500억원을 만들 계획인데, 이차보전 등 많은 지원을 할 예정이라 중소기업들이 사업을 적극적으로 펼칠 수 있도록 바란다”고 덧붙였어요."
인천시가 송도역세권구역 도시개발조합을 대상으로 자료 미제출 등에 따른 과태료 처분을 추진한다.,인천시가 송도역 근처에서 도시를 개발하는 단체에 자료를 제출하지 않은 것과 관련해 벌금을 부과하려고 합니다.,인천시가 송도역 주변의 도시 개발을 맡은 회사에 자료를 제출하지 않아서 벌어진 일에 대해 과태료를 부과하기로 했어요.
"경기신보는 기업의 성장성, 재무건전성, 사회적가치성 등을 감안해 파트너기업을 선발하고 있다. 경기신보의 파트너기업으로 선정될 경우 선정서와 현판을 수여받고, 선정기간 3년동안 보증지원 횟수와 무관하게 보증 우대지원을 받는다. 우대지원의 내용은 보증한도(120% 우대), 보증료 할인(0.2%p 차감), 보증비율 우대(100% 전액보증 지원) 등이 있다. 경기신보는 이러한 신용보증 우대지원과 더불어 차별화된 금융서비스 제공을 위해 신용평가 및 경기도 중소기업육성자금 평가 시 가점 부여 등 추가적인 우대혜택을 발굴할 계획이다.","경기신보는 좋은 기업을 찾기 위해 그 기업이 얼마나 성장할 수 있는지, 돈 관리가 잘 되고 있는지, 그리고 사회에 얼마나 도움이 되는지를 고려하고 있어요. 만약 당신의 기업이 경기신보의 파트너로 선정되면, 특별한 증서와 표지판을 받게 되고, 3년 동안 보증 지원을 받을 수 있어요. 이 지원은 보증을 받을 수 있는 한도를 120%로 늘려주고, 보증료를 0.2% 더 적게 내게 해주며, 필요한 돈을 100% 보장해주는 혜택이 포함돼요. 경기신보는 이런 특별한 지원 외에도, 기업의 신용을 평가할 때 더 좋은 점수를 줄 수 있는 방법을 찾아서 더 많은 혜택을 줄 계획이에요.","경기신보는 기업이 잘 성장하고 돈이 잘 돌아가며 사회에 도움이 되는 회사들을 도와주기로 했어요. 만약 어떤 회사에 선정되면, 선정서를 받아서 현판을 받을 수 있어요. 그리고 선정 기간이 3년 동안 보증 지원을 받을 수 있어요. 보증 지원은 보증한도가 120% 늘어나고, 보증료가 줄어들며, 보증비율이 100%로 늘어나요. 경기신보는 이러한 보증 지원과 함께, 다른 금융 서비스도 더 잘 제공하기 위해 추가적인 우대혜택도 찾아볼 거예요."
29일 정부와 에너지업계에 따르면 산업통상자원부는 오는 10월 도시가스 요금을 올리기로 하고 기획재정부와 인상 수위를 논의하고 있다.,"29일에 정부와 에너지 회사들이 모여서 이야기한 결과, 산업통상자원부라는 곳에서 10월에 도시가스 요금을 올리기로 했어요. 그래서 기획재정부라는 다른 부서와 요금을 얼마나 올릴지 논의하고 있답니다.","29일 정부와 에너지업계에 따르면, 산업통상자원부는 10월에 도시가스 요금을 올리기로 하고 기획재정부와 요금에 대해 이야기하고 있어요."
"연령별로 보면 올해 상반기에 50대의 평균 대부액이 771만1천원으로 최다였고 40대(757만4천원), 30대(707만원), 60대(653만원), 20대(564만9천원) 순이었다. 평균 대부 기간은 40대가 49.1개월로 가장 길었고 50대(48.3개월), 30대(47.8개월)가 뒤를 이었다.","올해 상반기에는 나이에 따라 대출받은 돈의 평균 금액이 달랐어요. 50대 사람들이 대출받은 돈이 평균 771만1천원이었고, 그 다음으로 40대는 757만4천원, 30대는 707만원, 60대는 653만원, 20대는 564만9천원이었어요. 

대출을 받은 기간도 나이에 따라 달랐는데, 40대가 평균 49.1개월로 가장 길었고, 그 다음은 50대가 48.3개월, 30대가 47.8개월이었어요. 여기서 '개월'은 몇 달을 의미해요.","올해 상반기에 50세 이상에 있는 사람들이 평균적으로 771만1천 원을 가지고 있었어요. 그 다음으로 40세, 30세, 60세, 20세 순서로 대부액이 높았어요. 평균 대부 기간은 40세가 가장 길었고, 50세가 48.3개월, 30세가 47.8개월, 60세가 47.8개월, 20세가 48.3개월이었어요."
5일 통계청에 따르면 6월 소비자물가지수는 108.22(2020년=100)로 지난해 같은 달보다 6.0% 올랐다. 이는 외환위기 당시인 1998년 11월(6.8%) 이후 23년7개월 만에 가장 높은 상승치다.,"5일에 발표된 통계청의 자료에 따르면, 6월의 소비자물가지수는 108.22로, 2020년을 기준으로 했을 때 100입니다. 이 숫자는 작년 같은 달보다 6.0% 올랐다는 뜻이에요. 이렇게 물가가 오른 것은 1998년 11월 이후로 23년 7개월 만에 가장 큰 상승폭이에요. 물가가 오른다는 것은 우리가 사는 물건이나 음식의 가격이 비싸졌다는 거예요.","5일 통계청에 따르면, 6월 소비자물가지수가 108.22로, 작년 같은 달보다 6.0% 올랐다고 해. 이는 외환위기였을 때 1998년 11월(6.8%) 이후로 가장 높은 상승치야."
이를 위해 시는 사업비로 모두 204억원을 들여 오는 2024년 3월부터 오는 2026년 완료를 목표로 설비를 증설한다는 계획이다.,이를 위해 시에서는 204억 원을 사용해서 2024년 3월부터 2026년까지 새로운 시설을 만들 계획이에요.,이를 위해 시는 사업을 위해 204억원을 들여서 2024년 3월부터 2026년까지 설비를 더 늘릴 계획이에요.
"2분기 경제성장률 0.7%…민간소비 3.0% 증가, 수출은 3.1% 줄어","2분기 동안 경제가 0.7% 성장했어요. 사람들이 물건을 사는 소비는 3.0% 늘어났지만, 수출은 3.1% 줄어들었어요. 

(여기서 '2분기'는 1년을 4부분으로 나눈 것 중 두 번째 부분을 말해요. '경제성장률'은 나라의 경제가 얼마나 커졌는지를 나타내는 숫자예요. '민간소비'는 사람들이 물건이나 서비스를 얼마나 많이 사는지를 의미해요. '수출'은 다른 나라에 물건을 파는 것을 뜻해요.)","2분기 동안 경제가 성장한 비율은 0.7%였어요. 하지만 민간 소비는 3.0% 늘어났고, 수출은 3.1% 줄어들었어요."
특히 원화 약세는 수입 물품의 환산 가격을 높여 인플레이션까지 부추길 우려가 있다.,특히 원화가 약해지면 외국에서 사오는 물건의 가격이 비싸져서 물가가 오를 수 있다는 걱정이 있어요.,특히 원화가 떨어지는 것은 물건의 가격을 높여서 물가가 오를까 걱정이에요.
강원도 등에 따르면 정부에 테슬라 기가팩토리 유치의향서를 전달한 곳은 17개 광역시·도 34개 기초지자체로 파악되고 있다.,"강원도 같은 곳에 따르면, 테슬라의 큰 공장을 유치하고 싶다는 서류를 정부에 보낸 곳은 17개의 큰 도시와 34개의 작은 지역이라고 해.","강원도에 따르면, 정부에 테슬라가 기가팩토를 유치하겠다고 요청한 곳은 17개 지역과 지방자치단체 34곳으로 확인되었어요."
"강원도는 수십 년 동안 자연과 환경을 지킨다는 명목으로 온갖 규제 늪 속에서 지내 왔다. 백두대간보호, 국립공원, 국유림, 유전자보호, 상수원보호 등 자연 분야 규제부터 접경지역, 동해안 철책, 폐광지역, 송전선로까지 엮인 수많은 규제로 손발 묶인 강원도의 몸부림은 처절하기까지 하다. 겹겹이 쌓인 철벽과도 같은 규제 때문에 한 발짝도 나아갈 수 없는 상황임에도 중앙정부와 수도권에서는 환경 논리만 앞세워 강원도와 주민들의 발목을 잡고 옴짝달싹 못 하게 한다. 산림·농림·환경·군사 4대 분야 규제면적만도 강원도 전체 면적의 130%에 해당하고 특히 강원도 면적의 절반에 달하는 중복규제 문제가 심각하다. 분단 직후부터 시작된 군사규제가 수십 년 지나 대규모로 해제됐지만, 강원도는 국유지, 보전산지 등 또 다른 규제에 묶여 삽질 한번 못 하기는 마찬가지다. 뿐만 아니라 동서고속철도와 오색케이블카 사업이 수차례 난관에 부딪히는 것도 규제로 둘러싸인 강원도의 현실을 보여주는 단적인 예다.","강원도는 오랫동안 자연과 환경을 보호한다는 이유로 많은 규제에 갇혀 지내왔어요. 예를 들어, 백두대간 보호, 국립공원, 국유림 같은 곳에서는 자연을 지키기 위해 여러 가지 규칙이 있어요. 하지만 이런 규칙 때문에 강원도는 발전하기가 정말 힘든 상황이에요. 중앙정부와 수도권에서는 환경을 지키는 것이 중요하다고 주장하면서 강원도의 발전을 막고 있어요. 

강원도의 산과 농장, 환경, 군사와 관련된 규제는 강원도 전체 면적보다도 더 넓어요. 특히 같은 지역에서 여러 규제가 겹치는 경우도 많아서 문제가 심각해요. 군사 규제는 몇십 년 전에 많이 풀렸지만, 여전히 다른 규제 때문에 강원도는 제대로 발전하지 못하고 있어요. 예를 들어, 동서고속철도와 오색케이블카 같은 큰 프로젝트도 규제로 인해 여러 번 어려움을 겪고 있어요. 이런 상황은 강원도가 규제에 갇혀 있다는 것을 잘 보여줘요.","강원도는 수십 년 동안 자연과 환경을 지키기 위해 많은 규제를 받아서 살아가고 있어요. 백두대간보호, 국립공원, 국유림, 유전자보호, 상수원보호 등 자연과 관련된 규제가 많아서 강원도의 생활이 힘들어지고 있어요.

이런 규제가 여러겹 쌓여서 한 발짝도 나아갈 수 없는 상황이에요. 하지만 중앙 정부와 수도권에서는 환경만 생각해서 강원도와 주민들의 발목을 잡고 있어요. 산림, 농업, 환경, 군사 분야의 규제가 많아서 강원도는 전체 면적의 130%에 해당해요. 특히 강원도의 면적의 절반에 달하는 중복규제 문제도 심각해요.

군사 규제가 군사라는 이유로 수십 년 동안 풀렸지만, 강원도는 국유지, 보전산지 등 다른 규제로 인해 계속 문제를 해결하지 못하고 있어요. 동서고속철도와 오색케이블카 사업도 여러 번 실패한 경험이 있어서 규제로 묶인 현실을 보여주는 좋은 예시예요."
"물론 시대에 뒤떨어진 기업을 무조건 지원하자는 말은 아니다. 구조조정을 통해 신산업으로 중소기업의 구조 개편이 필요하다. 그러나 멀쩡한 중소기업이 정부의 관심 부족으로 도태되는 것은 막아야 한다. 중소기업의 지속 가능한 미래를 위해 실질적 대책을 펼쳐야 할 때다. 과당경쟁을 넘어 출혈경쟁에 노출된 중소기업인 및 소상공인들의 구조조정을 촉진시킬 방안을 마련해야 한다. 이들의 퇴로를 열어 주고 노동시장으로 다시 진입할 수 있도록 재교육이나 재취업 등 고용 정책의 틀도 새롭게 짜야 한다. 그래야 중소기업인 및 소상공인들이 살고, 이는 지역경제의 활성화로 이어질 수 있다.","물론, 오래된 방식으로 운영되는 회사들을 무조건 도와주자는 뜻은 아니에요. 대신, 새로운 산업에 맞게 중소기업들이 변화할 수 있도록 도와줘야 해요. 하지만 잘 운영되고 있는 중소기업이 정부의 관심이 부족해서 어려움을 겪는 것은 막아야 해요. 중소기업이 앞으로도 잘 운영될 수 있도록 실제적인 방법을 찾아야 할 때입니다. 너무 치열한 경쟁으로 힘든 중소기업과 작은 가게들이 다시 일어설 수 있도록 도와주는 방법을 찾아야 해요. 이들이 다시 일할 수 있도록 교육을 하거나 새로운 일자리를 찾는 정책도 새롭게 만들어야 해요. 그렇게 해야 중소기업과 작은 가게들이 살아남고, 결국 우리 지역 경제도 더 활발해질 수 있어요.","물론, 옛날 방식대로 기업을 도와주자는 말은 아닙니다. 하지만 기업을 바꿔주고 싶다면, 구조를 바꾸는 것이 중요합니다. 하지만 잘 운영되고 있는 중소기업들이 정부의 관심을 받지 못하게 되는 것은 문제가 됩니다. 중소기업들이 계속 발전할 수 있도록 실질적인 대책을 마련해야 합니다. 중소기업이 힘든 상황에서 계속 남아있도록 도와주는 방법을 찾아야 합니다. 과도한 경쟁을 넘어서서 힘을 쓰는 기업들을 도와주는 방법도 필요합니다. 이런 기업들이 사라지는 것을 막아야 합니다. 중소기업들이 더 잘 살 수 있도록 재교육이나 재취업 같은 정책을 만들어야 합니다. 이렇게 하면 중소기업들이 계속 일할 수 있고, 이는 지역 경제를 활성화하는 데 도움이 됩니다."
화물·운송 경유 보조금 확대,"화물과 운송에 대한 지원금을 더 늘리기

이 문장은 화물이나 물건을 운반하는 데 필요한 돈을 정부가 더 많이 도와주겠다는 뜻이에요.",화물과 운송에 필요한 돈을 더 많이 지원하는 방법이 늘어났어요.
"삼성화재, DB손해보험, 현대해상, KB손해보험 등 4개사 기준으로 보면 이들 4개사에 접수된 침수 피해 건수는 총 6천526건, 추정 손해액은 총 884억5천만원에 달했다.","삼성화재, DB손해보험, 현대해상, KB손해보험이라는 4개의 보험회사를 보면, 이 회사들에 보고된 물에 잠긴 피해는 총 6,526건이었고, 그로 인해 예상되는 손해는 약 884억 5천만원에 이른다고 해요.","삼성화재, DB손해보험, 현대해상, KB손해보험 등 4개의 보험사에서 침수 피해가 생긴 건은 총 6,526건이에요. 이 피해로 인해 손해액은 총 884억 5천만 원이 예상돼요."
그러나 최근 금융당국을 중심으로 금융지주 회장 연임에 부정적인 기류가 흐르면서 전직 관료 출신인 이 전 실장이 최종 낙점됐다.,"최근에 금융 관련 기관들이 금융지주 회장이 계속 일하는 것에 대해 좋지 않은 의견을 내놓으면서, 이 전 실장이 최종적으로 선택되었어요. 이 전 실장은 예전 정부에서 일했던 사람입니다.","최근 금융당국에서 금융지주 회장으로 뽑힌 사람에 대해 부정적인 이야기가 나오고 있어서, 이 전 실장이 최종적으로 선택되었어요."
"의정부시, 캠프 카일 개발 특혜 논란 의식?...민간제안 사업 ‘소극 대처’",의정부시가 캠프 카일 개발에 대해 특별한 대우를 받는다는 논란이 있어요. 그래서 민간에서 제안한 사업에 대해 적극적으로 대응하지 않고 소극적으로 대처하고 있는 것 같아요.,의정부시에서 캠프 카일 개발에 대해 특혜가 있는지 논란이 되고 있어요. 민간에서 제안한 사업을 잘 대처하고 있지 않다는 이야기가 나오고 있어요.
기획재정부는 오는 23일부터 이런 내용을 담은 종부세법 시행령·시행규칙 개정안을 시행한다고 21일 밝혔다. 개정 규정은 시행일이 속하는 연도의 납세 의무분부터 적용된다.,기획재정부는 23일부터 새로운 종부세법 관련 규칙을 시행한다고 21일에 발표했어요. 이 새로운 규칙은 시행되는 해부터 세금을 내야 하는 사람들에게 적용된답니다.,기획재정부는 23일부터 종부세법을 바꾸는 법을 시행한다고 21일에 발표했어요. 이 법은 연도에 따라 세금을 내야 하는 사람들에게 적용되어요.
이 같은 시의 결정을 두고 효성구역 주민들이 강하게 반발하고 있다. 시가 사업시행자의 사업계획 변경을 인가해주면서 주민들의 의견을 제대로 듣지 않았기 때문이다.,"효성구역에 사는 사람들이 시청의 결정에 대해 매우 불만을 가지고 있어요. 시청이 사업을 하는 사람의 계획을 바꾸는 것을 허락했는데, 그 과정에서 주민들의 의견을 제대로 듣지 않았기 때문이에요.",이런 결정에 대해 효성구역 주민들이 매우 반대하고 있어요. 시청이 사업을 진행하는 사람들의 계획을 허락하면서 주민들의 의견을 제대로 듣지 않았기 때문이에요.
